job_id,title,company,location,posted,summary,job_url,tags,source
288670,Senior Electrical Commissioning Engineer,Metlen Εnergy & Metals,"Frankfurt, Germany",Posted today,"METLEN Energy & Metals is launching and expanding its M Renewables Division in Germany, and we are seeking a Senior Electrical Commissioning Engineer (Solar/BESS) to play a key role in establishing and delivering our utility-scale renewable energy projects across the country. This is a critical position supporting METLEN’s entry and growth in the German market.",https://www.euroclimatejobs.com/job_display/288670/Senior_Electrical_Commissioning_Engineer_Metlen_nergy_Metals_Frankfurt_Germany,Energy Engineer | Renewable Energy | Solar Energy,euroclimatejobs
288629,EPC Project Director - Offshore HVDC,GE Vernova,"Berlin or Rijswijk, Multiple Countries",Posted 1 day ago,"The Project Director (m/f/d) will be responsible for project on-time delivery, profit & loss accountability, and customer satisfaction through management of project related activities and resources. She/He will provide leadership to strategically manage risks & opportunities and ensure that the project follows high standards in terms of quality, health, safety , and environmental requirements. She/He will coordinate with the consortium partner in charge of building the offshore platform (consortium led by GE).",https://www.euroclimatejobs.com/job_display/288629/EPC_Project_Director_Offshore_HVDC_GE_Vernova_Berlin_or_Rijswijk_Multiple_Countries,Communication/Public Relations | Environment | Project Manager | Remote,euroclimatejobs
288624,Operations Planning and Performance Leader,GE Vernova,"Multiple Locations, Multiple Countries",Posted 1 day ago,"The Operations planning and performance leader plays a critical role in strengthening operational predictability, customer experience, and long‑term capacity alignment. This role owns the regional demand forecasting process for Field Services (OFS), Parts, and Repairs, producing a reliable 3+ year outlook that integrates commercial pipeline, fleet insights, and frontline intelligence.",https://www.euroclimatejobs.com/job_display/288624/Operations_Planning_and_Performance_Leader_GE_Vernova_Multiple_Locations_Multiple_Countries,Business and Finance | Oil and Gas | Remote,euroclimatejobs
288621,Senior Adsorption Specialist,Climeworks,"Opfikon, Zurich, Switzerland",Posted 1 day ago,,https://www.euroclimatejobs.com/job_display/288621/Senior_Adsorption_Specialist_Climeworks_Opfikon_Zurich_Switzerland,Carbon Capture and Storage | Energy Engineer,euroclimatejobs
288559,Sr Expert Renew Fuels&Feedstock Supply,OMV Group,"Bucharest, Romania",Posted 2 days ago,Romania BioEnergy and BioFuel Business and Finance Oil and Gas On-site Renewable Energy OMV Group,https://www.euroclimatejobs.com/job_display/288559/Sr_Expert_Renew_FuelsFeedstock_Supply_OMV_Group_Bucharest_Romania,BioEnergy and BioFuel | Business and Finance | Oil and Gas | Renewable Energy,euroclimatejobs
288558,Financial Analyst (Project Analysis),Air Products,"Chertsey or Barcelona, Multiple Countries",Posted 2 days ago,This is a great opportunity for someone who enjoys providing leadership in project analysis and related business decision support for investment activities in the Europe and Africa Industrial Gases Group. The supported business specializes in the supply of industrial gases via both dedicated plants and pipeline networks to a wide range of industries and segments across the region.,https://www.euroclimatejobs.com/job_display/288558/Financial_Analyst_Project_Analysis_Air_Products_Chertsey_or_Barcelona_Multiple_Countries,Business and Finance | Oil and Gas,euroclimatejobs
288553,Quality Manager BESS - Energy Products EMEA,Tesla,"Amsterdam, Netherlands",Posted 2 days ago,"As a Quality Engineer for Tesla Energy Products EMEA, you’ll ensure our Megapack installations meet the highest standards of reliability, safety, and compliance, from large utility scale projects in the UK to solar co-located projects in Southern Europe.",https://www.euroclimatejobs.com/job_display/288553/Quality_Manager_BESS_Energy_Products_EMEA_Tesla_Amsterdam_Netherlands,Energy Engineer | Renewable Energy | Solar Energy,euroclimatejobs
288503,Business Development Manager - Renewables Consulting,RINA,"Leatherhead, Manchester or Brighton, United Kingdom",Posted 3 days ago,"Excellent Business Development Manager (BDM) needed to join RINA's growing Energy, Power and Renewables Consulting business. You will be responsible for targeting and winning growth opportunities with Renewable energy (PV Solar, Battery, Wind) developers across the UK and Ireland.",https://www.euroclimatejobs.com/job_display/288503/Business_Development_Manager_Renewables_Consulting_RINA_Leatherhead_Manchester_or_Brighton_United_Kingdom,BioEnergy and BioFuel | Business and Finance | Hybrid | Renewable Energy,euroclimatejobs
288476,Technical Due Diligence Expert - Biogas International,Axpo,"Baden, Roma or Warsaw, Multiple Countries",Posted 3 days ago,"The Technical Due Diligence Expert – Biogas International is responsible for performing comprehensive technical assessments of biogas and biomethane projects, with a strong focus on agricultural feedstock-based plants across European markets. The role supports investment decisions, acquisitions, and project development by providing robust technical, operational, and risk analyses throughout the project lifecycle.",https://www.euroclimatejobs.com/job_display/288476/Technical_Due_Diligence_Expert_Biogas_International_Axpo_Baden_Roma_or_Warsaw_Multiple_Countries,BioEnergy and BioFuel | Business and Finance | Energy Engineer | Environment,euroclimatejobs
288475,Power Analyst,MET Group,"Budapest, Hungary",Posted 3 days ago,"We are looking to expand the Analytics team by hiring an experienced Power Analyst, to boost the expanding power markets analytics support and development, while integrating focus on cross-commodity aspects and opportunities.",https://www.euroclimatejobs.com/job_display/288475/Power_Analyst_MET_Group_Budapest_Hungary,Business and Finance | Carbon Capture and Storage | Climate and Energy Analyst | Oil and Gas,euroclimatejobs
288441,Senior Carbon Project Developer,Anthesis Group,Netherlands,Posted 6 days ago,"Our Carbon Project Development Team leads the development and delivery of carbon offset projects in diverse sectors, including renewable energy, waste management, agriculture, forestry, and Nature-Based Solutions. We support project owners and partners throughout the full project lifecycle—from early-stage design through to credit issuance under international carbon standards.",https://www.euroclimatejobs.com/job_display/288441/Senior_Carbon_Project_Developer_Anthesis_Group_Netherlands,Business and Finance | Carbon Capture and Storage | Environment | Hybrid,euroclimatejobs
288437,Energy Market Optimization Expert - BESS,Metlen Εnergy & Metals,"Paiania, Greece",Posted 6 days ago,"In this highly analytical role, you will focus on the design, development, and implementation of advanced optimization models that enable optimal BESS participation in the Greek Balancing Market, while also supporting Day-Ahead and Intraday market strategies.",https://www.euroclimatejobs.com/job_display/288437/Energy_Market_Optimization_Expert_BESS_Metlen_nergy_Metals_Paiania_Greece,Climate and Energy Analyst | Electricity,euroclimatejobs
288434,Associate Project Manager - Renewables & Power,RINA,"Genoa, Rome, Lecce, Bari or Rozzano, Italy",Posted 6 days ago,"The Associate Project Manager is responsible for supporting project execution and assisting in the coordination of tasks to ensure successful project delivery. Working under the guidance of a Project Manager, the Associate Project Manager helps manage resources, monitor project timelines, and maintain effective communication among team members and clients.",https://www.euroclimatejobs.com/job_display/288434/Associate_Project_Manager_Renewables_Power_RINA_Genoa_Rome_Lecce_Bari_or_Rozzano_Italy,Energy Engineer | Project Manager | Renewable Energy,euroclimatejobs
288380,Program Manager Solar PV,Goodman,"Vilvoorde, Belgium",Posted 7 days ago,"The successful candidate will define the annual PV roadmap and budget, manage the project pipeline, provide guidance to country teams, and act as the central escalation point for PV-related matters. The role also includes developing and embedding cross-border best practices, technical standards, and governance frameworks to ensure a consistent, future-proof PV portfolio.",https://www.euroclimatejobs.com/job_display/288380/Program_Manager_Solar_PV_Goodman_Vilvoorde_Belgium,Project Manager | Renewable Energy | Solar Energy,euroclimatejobs
288373,Nuclear Engineer,Amentum,"Bristol, United Kingdom",Posted 7 days ago,"This role is ideal for a confident and ambitious Engineer, several years into their career or a seasoned veteran. Flexibility is absolutely key to the role and you will have the opportunity to apply your skills in a variety of submarine related applications.",https://www.euroclimatejobs.com/job_display/288373/Nuclear_Engineer_Amentum_Bristol_United_Kingdom,Energy Engineer | Hybrid | Nuclear Energy,euroclimatejobs
288366,Gas Options Trader,MET Group,"Baar, Switzerland",Posted 7 days ago,"The Gas Option Trader will be responsible for pricing/valuing options on back of physical optionality and to manage and execute trading strategies on the market, contributing to portfolio optimization and market positioning within the Gas Trading team. This role requires in-depth knowledge of European gas markets, strong analytical capabilities, and a track record of delivering results in forward trading and to understand LNG physical optionality and how to manage associated risk on the financial market.",https://www.euroclimatejobs.com/job_display/288366/Gas_Options_Trader_MET_Group_Baar_Switzerland,Climate and Energy Analyst | Oil and Gas | Trader,euroclimatejobs
288312,Power & Gas Market Risk Analyst,Metlen Εnergy & Metals,"Athens, Greece",Posted 8 days ago,"We are seeking a motivated Power & Gas Market Risk Analyst to join our Market Risk/Middle Office team part of our Treasury & Investors Relations General Division, based in Athens. This role works closely with multiple internal stakeholders and plays a key role in ensuring transparency, control, and sound risk management practices.",https://www.euroclimatejobs.com/job_display/288312/Power_Gas_Market_Risk_Analyst_Metlen_nergy_Metals_Athens_Greece,Business and Finance | Climate and Energy Analyst | Oil and Gas | Trader,euroclimatejobs
288305,Senior Key Account Manager,Alpiq Group,"Madrid, Spain",Posted 8 days ago,"If you want to be part of this great project, join us as a Senior Key Account Manager! You will join a young, dynamic and international environment, where your role will consist on the development of the activities associated with the production process, with a commitment to the environment and the safety of people and facilities. We are looking for a person whose mission is the development of our Supply and Origination Business, (Electricity, Gas, sale of PPAs linked to supply and sale of GdOs), with large energy consumers as end customer and producers, being responsible for all commercial management.",https://www.euroclimatejobs.com/job_display/288305/Senior_Key_Account_Manager_Alpiq_Group_Madrid_Spain,Climate and Energy Analyst | Electricity | Oil and Gas | Sales and Marketing,euroclimatejobs
288304,Electrical Designer,AFRY,"Łódź, Kraków or Poznań, Poland",Posted 8 days ago,"You will be joining the HVAC team located in Bellinzona, Zürich and Lausanne belonging to the Building Services & Environment” Business Unit. This unit has approximately 92 employees globally, including Electrical designers and energy/environmental specialists. With more than 20 years of experience, the group is able to provide architects with all the services they need to develop energy-aware projects and design all the technical components inside the building.",https://www.euroclimatejobs.com/job_display/288304/Electrical_Designer_AFRY_d_Krakw_or_Pozna_Poland,Electricity | Energy Engineer | Hybrid,euroclimatejobs
288252,Carbon Sales Trader,OTC Flow,"Amsterdam, Netherlands",Posted 9 days ago,"You'll work closely with experienced sales traders, participate in training sessions, and receive ongoing support to fuel your professional growth. This immersive experience at OTC Flow is designed to strengthen your expertise, equipping you with the knowledge and skills necessary to excel in the industry.",https://www.euroclimatejobs.com/job_display/288252/Carbon_Sales_Trader_OTC_Flow_Amsterdam_Netherlands,Carbon Capture and Storage | Environment | Sales and Marketing | Trader,euroclimatejobs
288251,Energy Data Portfolio Analyst,TotalEnergies,"Geneva, Switzerland",Posted 9 days ago,"This fixed-Term contract offers the opportunity to gain a deep understanding of the European energy market structure, collaborate with Front, Middle, Operations, and Back Office teams, and interact with external stakeholders such as system operators. You will strengthen your programming expertise across multiple languages and actively support the migration to next-generation tools and platforms.",https://www.euroclimatejobs.com/job_display/288251/Energy_Data_Portfolio_Analyst_TotalEnergies_Geneva_Switzerland,Business and Finance | Climate and Energy Analyst,euroclimatejobs
288250,"Chief Project Manager, Water Access and Sustainability",Grundfos,"Bjerringbro, Denmark",Posted 9 days ago,"As Chief Project Manager, you will lead the creation and global rollout of performance-based service offerings. You will define the operating model, pilot new approaches, and ensure scalability and impact. This role demands strategic vision, strong stakeholder engagement, and the ability to influence across functions without direct reporting lines.",https://www.euroclimatejobs.com/job_display/288250/Chief_Project_Manager_Water_Access_and_Sustainability_Grundfos_Bjerringbro_Denmark,Environment | Hybrid | Project Manager,euroclimatejobs
288194,LNG Bunker Trader Europe,TotalEnergies,"Geneva, Switzerland",Posted 10 days ago,"As a trader in this space, you will require a strong understanding of industry trends, regulatory developments, customer dynamics and competitive positioning. The role requires agility, international exposure and the ability to operate effectively across multiple cultures and offices.",https://www.euroclimatejobs.com/job_display/288194/LNG_Bunker_Trader_Europe_TotalEnergies_Geneva_Switzerland,Oil and Gas | Trader,euroclimatejobs
288190,Sustainability Consultant,RINA,"Genoa, Italy",Posted 10 days ago,"At RINA Consulting S.p.A., as an Energy & Resource Efficiency Engineer, you will play a pivotal role supporting the engineering team dedicated to advancing innovative biofuels and Renewable Fuels of Non-Biological Origin (RFNBO) processes. This role emphasises delivering detailed technical analysis, problem-solving solutions, documentation, and calculations to assist in the transition towards more sustainable energy practices.",https://www.euroclimatejobs.com/job_display/288190/Sustainability_Consultant_RINA_Genoa_Italy,BioEnergy and BioFuel | Carbon Capture and Storage | Consultant | Environment,euroclimatejobs
288189,Investment Associate in Renewable Energies,Encavis,"Hamburg, Germany",Posted 10 days ago,Germany Business and Finance Hybrid Renewable Energy Solar Energy Wind Energy Encavis,https://www.euroclimatejobs.com/job_display/288189/Investment_Associate_in_Renewable_Energies_Encavis_Hamburg_Germany,Business and Finance | Hybrid | Renewable Energy | Solar Energy,euroclimatejobs
288110,Performance Engineer Adsorption,Climeworks,"Opfikon, Zurich, Switzerland",Posted 13 days ago,,https://www.euroclimatejobs.com/job_display/288110/Performance_Engineer_Adsorption_Climeworks_Opfikon_Zurich_Switzerland,Carbon Capture and Storage | Energy Engineer | Hybrid,euroclimatejobs
288109,Commercial Manager (Utility BESS),Trina Solar,"Home-based, Multiple Countries",Posted 13 days ago,Multiple Countries Business and Finance Remote Renewable Energy Sales and Marketing Solar Energy Trina Solar,https://www.euroclimatejobs.com/job_display/288109/Commercial_Manager_Utility_BESS_Trina_Solar_Home_based_Multiple_Countries,Business and Finance | Remote | Renewable Energy | Sales and Marketing,euroclimatejobs
288106,Senior Power Trader,Axpo,"Baden, Switzerland",Posted 13 days ago,,https://www.euroclimatejobs.com/job_display/288106/Senior_Power_Trader_Axpo_Baden_Switzerland,Hybrid | Renewable Energy | Trader,euroclimatejobs
288050,Group Energy Efficiency Project Manager,MOL Group,"Budapest, Hungary",Posted 14 days ago,,https://www.euroclimatejobs.com/job_display/288050/Group_Energy_Efficiency_Project_Manager_MOL_Group_Budapest_Hungary,Project Manager,euroclimatejobs
288049,System Process Engineer,Skytree,"Amsterdam, Netherlands",Posted 14 days ago,,https://www.euroclimatejobs.com/job_display/288049/System_Process_Engineer_Skytree_Amsterdam_Netherlands,Carbon Capture and Storage | Energy Engineer | Hybrid,euroclimatejobs
288048,Business Development Manager,Sunrock,"Düsseldorf, Germany",Posted 14 days ago,"As a Business Development Manager at Sunrock, you build long‑term energy partnerships that shape Germany’s industrial and real estate sectors. You act as a strategic sparring partner for developers, asset managers and sustainability teams, helping them navigate climate goals and future energy needs.",https://www.euroclimatejobs.com/job_display/288048/Business_Development_Manager_Sunrock_Dsseldorf_Germany,Business and Finance | Environment | Hybrid | Renewable Energy,euroclimatejobs
287971,Sales Engineer Energy,N-SIDE,"Louvain-La-Neuve, Belgium",Posted 15 days ago,"As a Sales Engineer Energy, you will bridge the gap between technical expertise and sales by effectively communicating the value of N-SIDE’s products and services to customers. Your role will involve understanding each customer’s unique needs, driving successful sales outcomes, and fostering long-term relationships.",https://www.euroclimatejobs.com/job_display/287971/Sales_Engineer_Energy_N_SIDE_Louvain_La_Neuve_Belgium,Electricity | Energy Engineer | Sales and Marketing,euroclimatejobs
287928,Project Controls Manager - Energy Sector,Turner & Townsend,"Amsterdam, Netherlands",Posted 16 days ago,"Project Controls Managers are responsible for the delivery of services on complicated projects (in the Benelux) typically of a value greater than €500M, and are specialised in the integration of; and/or specific delivery of one or more of the following disciplines: risk; cost; schedule; governance; quality assurance; performance management; data management and reporting. Project Controls services are used to provide the project owner with assurance and transparency pertaining to the execution of said project in accordance with prescribed objectives and/or KPIs.",https://www.euroclimatejobs.com/job_display/287928/Project_Controls_Manager_Energy_Sector_Turner_Townsend_Amsterdam_Netherlands,Project Manager,euroclimatejobs
287923,Senior Power System & Market Expert,N-SIDE,"Louvain-La-Neuve, Belgium",Posted 16 days ago,"As a Senior Power System & Market Expert, you will help N-SIDE thrive in the area of Energy Market Advisory and Power System Optimization. The successful candidate will contribute in delivering consulting and expert services for our clients, become a thought leader in market &system operation topics and contribute to business development around our grid and market solutions.",https://www.euroclimatejobs.com/job_display/287923/Senior_Power_System_Market_Expert_N_SIDE_Louvain_La_Neuve_Belgium,Business and Finance | Climate and Energy Analyst | Hybrid,euroclimatejobs
287921,Head of Engineering Thermal,Alpiq Group,"Milan, Italy",Posted 16 days ago,"Reporting into BU Head, you will lead a team to directly support technical management of Alpiq Thermal existing assets. You will support asset owners to maintain the assets and continuously improve availability and performance through upgrades, life extensions, repowering. You will oversee and steer engineering, project management and plant upgrades. You will create a common set of KPIs and procedures in the Business Unit and you will provide the BU Head with technical expertise to support decision making process. You will support the strategic growth ambition of the Business unit with deep technical analysis and due diligence on new assets.",https://www.euroclimatejobs.com/job_display/287921/Head_of_Engineering_Thermal_Alpiq_Group_Milan_Italy,Carbon Capture and Storage | Energy Engineer | Oil and Gas,euroclimatejobs
287860,Engineering Manager,Phlair,"Munich, Germany",Posted 17 days ago,,https://www.euroclimatejobs.com/job_display/287860/Engineering_Manager_Phlair_Munich_Germany,Carbon Capture and Storage | Energy Engineer | Environment,euroclimatejobs
287802,Principal Consultant - Climate & Sustainability in Banking Sector,ERM,"Utrecht, Netherlands",Posted 20 days ago,"You will advise senior executives, lead complex transformation programs, and help banks embed sustainability into their DNA—e.g. across lending practices, risk management, and product innovation. Your work will influence how financial institutions respond to climate change, nature-related risks, and the energy transition, while meeting regulatory expectations and creating measurable business value.",https://www.euroclimatejobs.com/job_display/287802/Principal_Consultant_Climate_Sustainability_in_Banking_Sector_ERM_Utrecht_Netherlands,Business and Finance | Consultant,euroclimatejobs
287796,Energy & Resource Efficiency Sustainability Consultant,RINA,"Genoa, Italy",Posted 20 days ago,"The mission of the Energy & Resource Efficiency Sustainability Consultant is to advance the integration of sustainability principles across industrial and civil sectors. This vital role involves spearheading initiatives in energy efficiency, resource optimisation, and greenhouse gas management to drive measurable environmental benefits and support organisational decarbonisation goals. The consultant will leverage specialised knowledge in sustainability domains to deliver innovative solutions, align with regulatory frameworks, and foster collaborative engagement with multidisciplinary teams. By delivering expert technical insights and strategic guidance, the consultant contributes directly to our commitment to sustainable business innovation and lasting positive impact on global environmental challenges.",https://www.euroclimatejobs.com/job_display/287796/Energy_Resource_Efficiency_Sustainability_Consultant_RINA_Genoa_Italy,Consultant | Environment,euroclimatejobs
287792,Sustainability Project Manager,Primark,"Dublin, Ireland",Posted 20 days ago,"Here at Primark, we want everyone to feel valued – so please bring your authentic self to work, of course with some other key experience and abilities for this role in particular:",https://www.euroclimatejobs.com/job_display/287792/Sustainability_Project_Manager_Primark_Dublin_Ireland,Environment | Project Manager,euroclimatejobs
287716,Asset Nuclear Leader,RINA,"Genoa, Milan or Rome, Italy",Posted 21 days ago,"As Asset Nuclear Leader, you will drive the strategic development, coordination, and overarching operational execution of the Nuclear Asset, ensuring that strategic directions set at VP level translate into concrete initiatives, high‑quality delivery, and measurable business outcomes. In this role, you will lead multidisciplinary teams across engineering, certification, licensing, safety, decommissioning, digital, R&D, and commercial areas to ensure strong market positioning, regulatory credibility, and technical excellence in the evolving global nuclear sector.",https://www.euroclimatejobs.com/job_display/287716/Asset_Nuclear_Leader_RINA_Genoa_Milan_or_Rome_Italy,Energy Engineer | Nuclear Energy,euroclimatejobs
287646,Senior Communications Officer,EBA - European Biogas Association,"Brussels, Belgium",Posted 22 days ago,"You will be part of a dynamic team of communication and event experts working on exciting projects and campaigns to enhance the visibility of the biogas sector. You will develop impactful marketing & communication campaigns and strategies, build compelling narratives, and ensure consistent branding and messaging across all communication platforms.",https://www.euroclimatejobs.com/job_display/287646/Senior_Communications_Officer_EBA_European_Biogas_Association_Brussels_Belgium,BioEnergy and BioFuel | Communication/Public Relations | Hybrid | Renewable Energy,euroclimatejobs
287598,Senior Environmental Consultant,PM Group,"Cork or Dublin, Ireland",Posted 23 days ago,Ireland Carbon Capture and Storage Consultant Environment Hybrid Renewable Energy PM Group,https://www.euroclimatejobs.com/job_display/287598/Senior_Environmental_Consultant_PM_Group_Cork_or_Dublin_Ireland,Carbon Capture and Storage | Consultant | Environment | Hybrid,euroclimatejobs
287525,Senior Market Risk Manager,MET Group,"Baar, Switzerland",Posted 24 days ago,Switzerland Business and Finance Climate and Energy Analyst Oil and Gas On-site MET Group,https://www.euroclimatejobs.com/job_display/287525/Senior_Market_Risk_Manager_MET_Group_Baar_Switzerland,Business and Finance | Climate and Energy Analyst | Oil and Gas,euroclimatejobs
