job_id,title,company,location,posted,summary,job_url,tags,source
288254,Global Product Group Manager CCS,ANDRITZ,"Raaba-Grambach, Austria",Posted 9 days ago,"Identify global business opportunities and develop strategic partnerships to strengthen the market position of ANDRITZ carbon capture technologies; Expand and globalize the business organization with focus regions in Europe, North and South America;",https://www.euroclimatejobs.com/job_display/288254/Global_Product_Group_Manager_CCS_ANDRITZ_Raaba_Grambach_Austria,Business and Finance | Carbon Capture and Storage | Environment | Sales and Marketing,euroclimatejobs
288102,Commercial Project Manager,ANDRITZ,"Raaba-Grambach, Austria",Posted 13 days ago,"Full commercial responsibility for a single-line project from contract effectiveness to end of warranty (time, cost, quality), typically within EPC/EPCM project structures. Oversee contract variations, claims, cost controlling, forecasting, and reporting",https://www.euroclimatejobs.com/job_display/288102/Commercial_Project_Manager_ANDRITZ_Raaba_Grambach_Austria,Business and Finance | Carbon Capture and Storage | Hybrid | Project Manager,euroclimatejobs
287863,(Senior) Commercial Asset Manager Renewables,Uniper,"Multiple Locations, Multiple Countries",Posted 17 days ago,"Managing key project contracts (e.g., construction contracts, service agreements, leases); oversee vendor and subcontractor agreements, ensuring compliance with agreed terms. Identify, monitor, and mitigate financial and contractual risks in coordination",https://www.euroclimatejobs.com/job_display/287863/Senior_Commercial_Asset_Manager_Renewables_Uniper_Multiple_Locations_Multiple_Countries,Business and Finance | Hybrid | Renewable Energy | Solar Energy,euroclimatejobs
287233,PPA Origination Manager in Renewable Energies,Encavis,"Hamburg or Neubiberg, Germany",Posted 30 days ago,"You will structure and negotiate long-term PPAs for individual projects or project portfolios from our European pipeline. You will also prepare and coordinate PPA tender processes for projects in our pipeline, as well as handle and prepare offers for",https://www.euroclimatejobs.com/job_display/287233/PPA_Origination_Manager_in_Renewable_Energies_Encavis_Hamburg_or_Neubiberg_Germany,Business and Finance | Electricity | Hybrid | Renewable Energy,euroclimatejobs
287042,Senior Renewable Energy Consultant,Veolia,"Madrid, Spain",Posted 36 days ago,"Lead and deliver consulting assignments in renewable energy planning, project evaluation, and strategy development for public and private sector clients; Conduct technical and economic analyses of renewable energy projects and",https://www.euroclimatejobs.com/job_display/287042/Senior_Renewable_Energy_Consultant_Veolia_Madrid_Spain,Consultant | Renewable Energy,euroclimatejobs
286867,"Head of Asset Management, Green Power",Alpiq Group,"Multiple Locations, Europe, Multiple Countries",2 days left Posted 41 days ago,"You will lead a pan European organisation comprising asset managers in the various countries where Alpiq active is (CH, ES, IT, FR, Nordics and new countries with assets under development), covering various assets and technologies Wind, PV, BESS, green",https://www.euroclimatejobs.com/job_display/286867/Head_of_Asset_Management_Green_Power_Alpiq_Group_Multiple_Locations_Europe_Multiple_Countries,Business and Finance | Climate and Energy Analyst | Electricity | Hydropower Energy,euroclimatejobs
286803,Environmental Due Diligence Project Lead,Engie,"London, United Kingdom",1 day left Posted 42 days ago,"Lead due diligence activities for potential data centre developments across EMEA. This role involves client management, strategic definition, design coordination, and project management during early-stage development and feasibility phases of site",https://www.euroclimatejobs.com/job_display/286803/Environmental_Due_Diligence_Project_Lead_Engie_London_United_Kingdom,Business and Finance | Environment | Hybrid | Project Manager,euroclimatejobs
288613,Principal Consultant/Associate Director - Energy Transition,Anthesis Group,United Kingdom,Posted 1 day ago,"The candidate will be primarily working for the Energy Transition service line, but it will also support the Climate Risk & Resilience and Green House Gas accounting service lines. The Energy Transition service line delivers unique projects that require",https://www.euroclimatejobs.com/job_display/288613/Principal_Consultant_Associate_Director_Energy_Transition_Anthesis_Group_United_Kingdom,Business and Finance | Carbon Capture and Storage | Consultant | Environment,euroclimatejobs
288530,Environment & Sustainability Officer,EUnited - European Engineering Industries Association,"Brussels or Frankfurt, Multiple Countries","Posted 2 days ago
                
                                      
                    Deadline 17 April","Coordinate EUnited’s cross-sector Environmental and Sustainability Committees. Monitor, analyse and provide early warning on EU product-related environmental and sustainability regulations (e.g. substance legislation, waste legislation, ecodesign ...);",https://www.euroclimatejobs.com/job_display/288530/Environment_Sustainability_Officer_EUnited_European_Engineering_Industries_Association_Brussels_or_Frankfurt_Multiple_Countries,Communication/Public Relations | Environment | Government and Associations | Production and Operations,euroclimatejobs
288526,"Project Manager Industrial Transformation and Lead Markets, Europe (f/m/d)",Agora Industry,"Brussels, Belgium","Posted 2 days ago
                
                                      
                    Deadline 6 April","Contributing to research projects on industrial transformation and lead markets in Europe. Preparing policy recommendations on European industrial transformation policies, especially for Lead Markets. Analysing European",https://www.euroclimatejobs.com/job_display/288526/Project_Manager_Industrial_Transformation_and_Lead_Markets_Europe_f_m_d_Agora_Industry_Brussels_Belgium,Business and Finance | Environment | Hybrid | Policy and Regulation,euroclimatejobs
288501,Head Intraday Algorithmic Trading,Alpiq Group,"Olten, Switzerland",Posted 3 days ago,"Lead the design, development, and execution of algorithmic trading strategies for day-ahead, intraday, and imbalance markets across CWE and the Nordics; Hold full P&L responsibility for algorithmic trading activities, ensuring alignment with trading",https://www.euroclimatejobs.com/job_display/288501/Head_Intraday_Algorithmic_Trading_Alpiq_Group_Olten_Switzerland,Climate and Energy Analyst | Trader,euroclimatejobs
288448,Two Sector Officers - Green Portfolio - VA 21/2026,FMO - Financial Mechanism Office,"Brussels, Belgium","Posted 3 days ago
                
                                      
                    Deadline 8 April","You will support progress in the development and implementation of programmes, providing expert advice to Donors and Beneficiary States. You will manage a portfolio of programmes in several Beneficiary States and lead interdisciplinary programme teams",https://www.euroclimatejobs.com/job_display/288448/Two_Sector_Officers_Green_Portfolio_VA_21_2026_FMO_Financial_Mechanism_Office_Brussels_Belgium,Business and Finance | Environment | Government and Associations | Policy and Regulation,euroclimatejobs
288442,Senior Biofuels Trader,OTC Flow,"Amsterdam, Netherlands",Posted 6 days ago,"You will take ownership of developing and executing a results-driven, over the counter, brokering strategy. You will focus on building a strong client portfolio, managing relationships, and closing high-value deals. This role demands an independent,",https://www.euroclimatejobs.com/job_display/288442/Senior_Biofuels_Trader_OTC_Flow_Amsterdam_Netherlands,BioEnergy and BioFuel | Carbon Capture and Storage | Renewable Energy | Sales and Marketing,euroclimatejobs
288384,International Inward Investment Specialist (BEL26.071),Scottish Government,"Brussels, Belgium","Posted 6 days ago
                
                                      
                    Deadline 29 March","Your purpose is to grow Scotland’s inward investment footprint across Europe by identifying, developing, and progressing high‑potential opportunities - particularly across BeNeLux - aligned to priority areas including Energy Transition and Data &",https://www.euroclimatejobs.com/job_display/288384/International_Inward_Investment_Specialist_BEL26071_Scottish_Government_Brussels_Belgium,Business and Finance | Government and Associations | Hybrid | Policy and Regulation,euroclimatejobs
288332,Communications Officer,ECMWF - European Centre for Medium-Range Weather Forecasts,"Bonn, Germany","Posted 7 days ago
                
                                      
                    Deadline 12 April","Develop and implement communications concepts and plans, for delivering on Destination Earth communications objectives, in collaboration with the DestinE and Digital Campaigns Communication Manager; Develop engaging and regular content for use on digital",https://www.euroclimatejobs.com/job_display/288332/Communications_Officer_ECMWF_European_Centre_for_Medium_Range_Weather_Forecasts_Bonn_Germany,Communication/Public Relations | Environment | Government and Associations | Hybrid,euroclimatejobs
288313,Senior Portfolio Manager - Project Development in Renewable Energies,Encavis,"Hamburg or Neubiberg, Germany",Posted 8 days ago,"You will drive the transition to digital-first systems and scalable processes, ensure the integrity and quality of our development data, and optimise processes for smooth portfolio operations. Using tools such as Sitetracker and our M365 collaboration",https://www.euroclimatejobs.com/job_display/288313/Senior_Portfolio_Manager_Project_Development_in_Renewable_Energies_Encavis_Hamburg_or_Neubiberg_Germany,Business and Finance | Hybrid | Project Manager | Renewable Energy,euroclimatejobs
288262,Public Affairs Manager,CEFIC - European Chemical Industry Council,"Brussels, Belgium","Posted 8 days ago
                
                                      
                    Deadline 10 April","Develop and execute advocacy strategies aligned with Cefic’s priorities, particularly within the framework of the Political Guidelines for the European Commission 2024-2029, including the Clean Industrial Deal; Monitor legislative and policy",https://www.euroclimatejobs.com/job_display/288262/Public_Affairs_Manager_CEFIC_European_Chemical_Industry_Council_Brussels_Belgium,Communication/Public Relations | Environment | Government and Associations | Policy and Regulation,euroclimatejobs
288193,Head Climate Certificates & Dry Bulk Trading,Axpo,"Baden, Switzerland",Posted 10 days ago,"Take proprietary trading positions in emissions allowances, climate certificates, and related fuels, such as coal; Lead and integrate a team of traders and analysts, fostering knowledge transfer; Expand trading activities into new regions (e.g. Asia, US)",https://www.euroclimatejobs.com/job_display/288193/Head_Climate_Certificates_Dry_Bulk_Trading_Axpo_Baden_Switzerland,Climate and Energy Analyst | Environment | Hybrid | Trader,euroclimatejobs
288183,CO₂ Pipeline Transport R&T Project Lead,TotalEnergies,"Stavanger, Norway","Posted 10 days ago
                
                                      
                    Deadline 31 March",You will manage research and technology development activities related to CO₂ pipeline transport within the CO₂ Transport & Storage (T&S) program. This strategic position contributes directly to building a full‑chain CCS industry - an essential,https://www.euroclimatejobs.com/job_display/288183/CO_Pipeline_Transport_RT_Project_Lead_TotalEnergies_Stavanger_Norway,Carbon Capture and Storage | Energy Engineer | Environment | Project Manager,euroclimatejobs
288046,Senior Project Manager for Energy Solutions,Telelink Infra Services,Bulgaria,Posted 14 days ago,"You will lead the planning, execution, and delivery of solar energy projects. This role is essential in coordinating with cross-functional teams, managing project timelines, and ensuring adherence to safety and quality standards Maintaining up-to-date",https://www.euroclimatejobs.com/job_display/288046/Senior_Project_Manager_for_Energy_Solutions_Telelink_Infra_Services_Bulgaria,Project Manager | Renewable Energy | Solar Energy,euroclimatejobs
288043,Senior Transaction Manager,Vattenfall,"Multiple Locations, Multiple Countries","Posted 14 days ago
                
                                      
                    Deadline 26 March","In this role, you will lead complex strategic initiatives and partnership-related projects across the Onshore Wind portfolio, acting as a key driver of strategic direction, portfolio optimisation, and partnership development. You will take end‑to‑end",https://www.euroclimatejobs.com/job_display/288043/Senior_Transaction_Manager_Vattenfall_Multiple_Locations_Multiple_Countries,Business and Finance | Renewable Energy | Wind Energy,euroclimatejobs
287989,Renewables Portfolio Lead,AECOM,"Dublin, Ireland",Posted 15 days ago,"As a leader you will be responsible for fostering a culture of success, engagement, and development within the team while ensuring the successful management of projects from inception to completion. You will bring your deep understanding of the Irish",https://www.euroclimatejobs.com/job_display/287989/Renewables_Portfolio_Lead_AECOM_Dublin_Ireland,Business and Finance | Hybrid | Renewable Energy | Sales and Marketing,euroclimatejobs
287929,Senior Wind Renewable Energy Consultant,Wood Group,"Glasgow, United Kingdom",Posted 16 days ago,"Assess renewable energy projects on behalf of lenders, investors and other project stakeholders. Manage multi-discipline teams of engineers (and other technical staff) in the completion of due diligence assignments for exacting clients. Act as main",https://www.euroclimatejobs.com/job_display/287929/Senior_Wind_Renewable_Energy_Consultant_Wood_Group_Glasgow_United_Kingdom,Business and Finance | Consultant | Hybrid | Project Manager,euroclimatejobs
287805,"Director - Energy, Mobility & Sustainability",CERRE - Centre on Regulation in Europe,"Brussels, Belgium","Posted 20 days ago
                
                                      
                    Deadline 30 March","Driving CERRE positioning on energy, mobility and sustainability (EMS) in cooperation with the senior academic staff and the corporate and regulatory members. Managing relationships with CERRE’s EMS members, academics, and institutional stakeholders.",https://www.euroclimatejobs.com/job_display/287805/Director_Energy_Mobility_Sustainability_CERRE_Centre_on_Regulation_in_Europe_Brussels_Belgium,Environment | Policy and Regulation | Sustainable Transport,euroclimatejobs
287794,Environmental Permitting Consultant,RINA,"Genoa, Rome or Milan, Italy",Posted 20 days ago,"Lead and oversee comprehensive environmental impact assessments for energy, infrastructure, and industrial projects, analyzing factors such as air quality, water resources, and noise; Provide strategic guidance and technical expertise in conducting",https://www.euroclimatejobs.com/job_display/287794/Environmental_Permitting_Consultant_RINA_Genoa_Rome_or_Milan_Italy,Consultant | Environment,euroclimatejobs
287729,Sales Support Specialist,RES Group,"Kings Langley, United Kingdom",Posted 21 days ago,"The position combines commercial process support (proposal and contract template management and support, tender coordination) with sales analytics and business system administration (Salesforce reporting, revenue tracking, and forecasting).",https://www.euroclimatejobs.com/job_display/287729/Sales_Support_Specialist_RES_Group_Kings_Langley_United_Kingdom,Renewable Energy | Sales and Marketing | Solar Energy | Wind Energy,euroclimatejobs
287712,Environmental Coordinator,Eni S.p.A.,"Madrid, Spain",Posted 21 days ago,"Contribute to the implementation of renewable projects, with a particular focus on the execution and operation stages, by identifying and managing key environmental aspects (PVA, DIA, compensatory measures, etc.); Support projects during the execution and",https://www.euroclimatejobs.com/job_display/287712/Environmental_Coordinator_Eni_SpA_Madrid_Spain,Environment | Renewable Energy | Solar Energy | Wind Energy,euroclimatejobs
287595,Environmental Permitting Consultant,WSP,"Frankfurt am Main, Germany",Posted 23 days ago,"Conducting environmental due diligence studies for planned operational sites and development projects; Advising on environmental permitting and approval planning (e.g. under the German Federal Immission Control Act – BImSchG, and the Water Resources Act",https://www.euroclimatejobs.com/job_display/287595/Environmental_Permitting_Consultant_WSP_Frankfurt_am_Main_Germany,Consultant | Environment | Hybrid,euroclimatejobs
287593,Senior Business Development Manager B2B Carbon Markets,Carbonfuture,"Multiple Locations, Europe, Multiple Countries",Posted 23 days ago,"You play a pivotal role in partnering with our (prospective) clients, guiding them in sourcing the essential, de-risked carbon removal credit portfolios to achieve their climate objectives. Your unique blend of approachability, carbon markets expertise",https://www.euroclimatejobs.com/job_display/287593/Senior_Business_Development_Manager_B2B_Carbon_Markets_Carbonfuture_Multiple_Locations_Europe_Multiple_Countries,Business and Finance | Carbon Capture and Storage | Remote | Sales and Marketing,euroclimatejobs
287510,Digital Strategy Officer,Eurogroup for Animals,"Brussels, Belgium",1 day left Posted 24 days ago,"The role combines technical oversight, content production, and campaign delivery. It acts as the organisation’s focal point for digital implementation, website management, email marketing, analytics, and the digital execution of mass‑mobilisation",https://www.euroclimatejobs.com/job_display/287510/Digital_Strategy_Officer_Eurogroup_for_Animals_Brussels_Belgium,Communication/Public Relations | Environment | NGO | Policy and Regulation,euroclimatejobs
287435,Principal Wind Renewable Energy Consultant,Wood Group,"Glasgow, United Kingdom",Posted 27 days ago,"Assess renewable energy projects on behalf of lenders, investors and other project stakeholders; Manage multi-discipline teams of engineers (and other technical staff) in the completion of due diligence assignments for exacting clients",https://www.euroclimatejobs.com/job_display/287435/Principal_Wind_Renewable_Energy_Consultant_Wood_Group_Glasgow_United_Kingdom,Business and Finance | Consultant | Hybrid | Project Manager,euroclimatejobs
287411,"Public Affairs Manager Energie, Klima & Verkehr (m/w/d)",Schwarz Corporate Affairs,"Brussels, Belgium",Posted 28 days ago,"Strategieentwicklung im Themenbereich Energie, Klima sowie Verkehr; Monitoring, Analyse und Bewertung von politischen und gesellschaftlichen Entwicklungen auf europäischer Ebene; Enger Austausch mit den Unternehmen der Schwarz Gruppe zu relevanten",https://www.euroclimatejobs.com/job_display/287411/Public_Affairs_Manager_Energie_Klima_Verkehr_m_w_d_Schwarz_Corporate_Affairs_Brussels_Belgium,Communication/Public Relations | Environment | Government and Associations | Hybrid,euroclimatejobs
287316,Principal Product Sustainability Consultant,Anthesis Group,United Kingdom,Posted 29 days ago,"This role focuses on helping clients design, evaluate, and scale sustainable products, integrating environmental performance into product strategy, business models, and effective design for sustainability. You will bring a strong foundation in sustainable",https://www.euroclimatejobs.com/job_display/287316/Principal_Product_Sustainability_Consultant_Anthesis_Group_United_Kingdom,Carbon Capture and Storage | Consultant | Environment | Hybrid,euroclimatejobs
287235,International Sales Trader,OTC Flow,"Amsterdam, Netherlands",Posted 30 days ago,"You’ll be at the forefront of the environmental commodities market, connecting clients with the instruments they need to meet regulatory and sustainability goals. This role is equal parts commercial drive and market awareness: you’ll proactively",https://www.euroclimatejobs.com/job_display/287235/International_Sales_Trader_OTC_Flow_Amsterdam_Netherlands,Business and Finance | Carbon Capture and Storage | Sales and Marketing | Trader,euroclimatejobs
287217,Project Development Manager,Metlen Εnergy & Metals,"Milan, Italy",Posted 31 days ago,"Secure land rights: Manage the process of securing land rights for wind, PV, and BESS projects to allow for planning, permitting, construction, operation, and maintenance.  Provide assistance to the Head of Development Manager in the management in due",https://www.euroclimatejobs.com/job_display/287217/Project_Development_Manager_Metlen_nergy_Metals_Milan_Italy,Business and Finance | Environment | Project Manager | Renewable Energy,euroclimatejobs
287207,Principal Nuclear Environmental Consultant,Amentum,"Reading, United Kingdom",Posted 31 days ago,"Your main responsibility will be to apply your knowledge, experience and expertise to the environmental aspects that need to be considered in site operations, radioactive waste management and nuclear decommissioning challenges. You will lead (or support)",https://www.euroclimatejobs.com/job_display/287207/Principal_Nuclear_Environmental_Consultant_Amentum_Reading_United_Kingdom,Consultant | Environment | Hybrid | Nuclear Energy,euroclimatejobs
287159,Power Portfolio Specialist,MET Group,"Sofia, Bulgaria",Posted 34 days ago,"Communicate with internal and external parties, TSOs, DSOs and public authorities across the Balkans; Monitoring of production/consumption data; Forecasting and optimization of the current portfolio; Prepare settlements and statements",https://www.euroclimatejobs.com/job_display/287159/Power_Portfolio_Specialist_MET_Group_Sofia_Bulgaria,Climate and Energy Analyst,euroclimatejobs
287112,Market Risk Analyst,Axpo,"Madrid, Spain",Posted 35 days ago,Play a key role in analyzing and reporting risk and P&L with a focus on LNG trading and the proprietary trading division (CEMT). Shape the future of energy by contributing your expertise to a dynamic and innovative team. Perform daily analysis,https://www.euroclimatejobs.com/job_display/287112/Market_Risk_Analyst_Axpo_Madrid_Spain,Business and Finance | Climate and Energy Analyst | Hybrid,euroclimatejobs
286902,Senior Project Manager - EPC Projects,GE Vernova,"Madrid or Villeurbanne, Multiple Countries",Posted 38 days ago,"Lead or be part of a Large & Complex Full Turnkey HVDC or AC Systems on-shore and/or off-shore project including Design, Supply, Construction, Electro-mechanical Installation and Testing & Commissioning works.  Managing the Project team",https://www.euroclimatejobs.com/job_display/286902/Senior_Project_Manager_EPC_Projects_GE_Vernova_Madrid_or_Villeurbanne_Multiple_Countries,Business and Finance | Energy Engineer | Project Manager,euroclimatejobs
286851,Senior Economic Policy Analyst - Energy Policy & Infrastructure Finance,EMPN - European Macro Policy Network,"Brussels, Belgium",2 days left Posted 41 days ago,"You will help shape debates on the financing of the energy and climate transition through rigorous analysis, strategic outreach, and cross-border coordination. This includes work on electricity grids and interconnections, public and private",https://www.euroclimatejobs.com/job_display/286851/Senior_Economic_Policy_Analyst_Energy_Policy_Infrastructure_Finance_EMPN_European_Macro_Policy_Network_Brussels_Belgium,Business and Finance | Climate and Energy Analyst | Communication/Public Relations | Electricity,euroclimatejobs
286805,Senior Market Risk Analyst,Axpo,"Baden, Switzerland",1 day left Posted 42 days ago,"Join Axpo Solutions AG and play a key role in shaping the future of energy markets. As a Senior Market Risk Analyst, you will focus on analyzing and reporting risk and P&L, ensuring robust risk control processes, and contributing to IFRS reporting. Bring",https://www.euroclimatejobs.com/job_display/286805/Senior_Market_Risk_Analyst_Axpo_Baden_Switzerland,Business and Finance | Climate and Energy Analyst | Hybrid,euroclimatejobs
286736,Global Portfolio Position Monitoring,ContourGlobal,"Madrid, Spain",Expiring today Posted 43 days ago,"Monitor and report on the global energy portfolio position, including hedging and exposure metrics; Conduct sensitivity analysis and scenario modeling to assess the impact of market changes, regulatory developments, and operational risks on the company's",https://www.euroclimatejobs.com/job_display/286736/Global_Portfolio_Position_Monitoring_ContourGlobal_Madrid_Spain,Business and Finance | Climate and Energy Analyst | Trader,euroclimatejobs
288673,Renewables Development Lead,Fuse Energy,"London, United Kingdom",Posted today,"We are now looking for an incredibly driven and ambitious individual to supercharge and expand our greenfield utility-scale development projects with a specific focus on land acquisition and landowner engagement. The ideal candidate will be an exceptional independent operator willing to work at high intensity as part of our core team. They will have a very strong bias towards action and feel comfortable generating and handling both outbound and inbound leads. They will also drive project development strategy, including site identification and origination, outreach to landowners and feasibility studies.",https://www.euroclimatejobs.com/job_display/288673/Renewables_Development_Lead_Fuse_Energy_London_United_Kingdom,Business and Finance | Renewable Energy | Sales and Marketing,euroclimatejobs
