row_id,base_model,variant_id,role,model,barrier_title,explanation,iteration,timestamp,truncated,is_duplicate,attempts,transport_attempts,transport_error,theme,theme_attempts,theme_error,theme_model,theme_temperature,cluster_text,cluster,cluster_prob,primary_category,secondary_category,human_labelled_clusters
phi4-normative_07_b5,phi4,phi4-normative,normative,phi4-normative-enh:latest,Public Awareness and Acceptance,Limited public understanding of the benefits and functionality of DC systems can lead to resistance or indifference towards adopting new technologies that require behavioral changes in energy consumption patterns.,7,20260505_121738,no,False,2,2,,public awareness,1,,gpt-5.4-mini,0.2,Public Awareness and Acceptance. Limited public understanding of the benefits and functionality of DC systems can lead to resistance or indifference towards adopting new technologies that require behavioral changes in energy consumption patterns.,14,0.9436442621771672,policy,general,Public awareness and acceptance
phi4-normative2_07_b1,phi4,phi4-normative2,normative,phi4-normative2-enh:latest,Interoperability Challenges,"Different manufacturers may produce DC components with varying standards, leading to compatibility issues. This lack of standardization can hinder seamless integration into existing AC systems.",7,20260505_121738,no,False,1,1,,compatibility issues,1,,gpt-5.4-mini,0.2,"Interoperability Challenges. Different manufacturers may produce DC components with varying standards, leading to compatibility issues. This lack of standardization can hinder seamless integration into existing AC systems.",13,0.7801102385795506,technical,general,Interoperability challenges with existing AC infrastructure
phi4-normative2_07_b2,phi4,phi4-normative2,normative,phi4-normative2-enh:latest,Economic Viability Concerns,"The initial costs for transitioning from AC to DC infrastructure might be high. Without clear long-term economic benefits or incentives, organizations may be reluctant to invest in DC technologies.",7,20260505_121738,no,False,1,1,,high upfront costs,1,,gpt-5.4-mini,0.2,"Economic Viability Concerns. The initial costs for transitioning from AC to DC infrastructure might be high. Without clear long-term economic benefits or incentives, organizations may be reluctant to invest in DC technologies.",9,1.0,general,technical,High upfront transition costs
phi4-normative2_07_b3,phi4,phi4-normative2,normative,phi4-normative2-enh:latest,Workforce Training and Expertise Gaps,"There is a shortage of skilled professionals trained specifically in DC systems. This gap can slow down the adoption process as industries struggle to find qualified personnel for installation, maintenance, and troubleshooting.",7,20260505_121738,no,False,1,1,,skilled labor shortage,1,,gpt-5.4-mini,0.2,"Workforce Training and Expertise Gaps. There is a shortage of skilled professionals trained specifically in DC systems. This gap can slow down the adoption process as industries struggle to find qualified personnel for installation, maintenance, and troubleshooting.",2,1.0,general,technical,Shortage in skilled workforce 
phi4-normative2_07_b4,phi4,phi4-normative2,normative,phi4-normative2-enh:latest,Regulatory Uncertainty,Existing regulations are primarily designed around AC systems. The uncertainty regarding how new DC technologies will be regulated or integrated into current frameworks could deter potential adopters from making the switch.,7,20260505_121738,no,False,1,1,,regulatory uncertainty,1,,gpt-5.4-mini,0.2,Regulatory Uncertainty. Existing regulations are primarily designed around AC systems. The uncertainty regarding how new DC technologies will be regulated or integrated into current frameworks could deter potential adopters from making the switch.,3,1.0,policy,general,Regulatory uncertainty and hurdles
phi4-normative2_07_b5,phi4,phi4-normative2,normative,phi4-normative2-enh:latest,Perception of Technological Maturity,"Many stakeholders may perceive DC technology as less mature compared to established AC solutions, leading to hesitancy in adopting it for critical applications due to concerns over reliability and performance.",7,20260505_121738,no,False,1,1,,perceived immaturity,1,,gpt-5.4-mini,0.2,"Perception of Technological Maturity. Many stakeholders may perceive DC technology as less mature compared to established AC solutions, leading to hesitancy in adopting it for critical applications due to concerns over reliability and performance.",-1,0.0,,,
phi4-subject_matter_07_b1,phi4,phi4-subject_matter,subject_matter,phi4-subject_matter-enh:latest,Interoperability Challenges,"The lack of standardized interfaces between existing AC systems and emerging DC technologies can hinder integration, leading to compatibility issues that complicate widespread adoption.",7,20260505_121738,no,False,1,1,,interface compatibility issues,1,,gpt-5.4-mini,0.2,"Interoperability Challenges. The lack of standardized interfaces between existing AC systems and emerging DC technologies can hinder integration, leading to compatibility issues that complicate widespread adoption.",13,0.9619282223097064,technical,general,Interoperability challenges with existing AC infrastructure
phi4-subject_matter_07_b2,phi4,phi4-subject_matter,subject_matter,phi4-subject_matter-enh:latest,Limited Supply Chain Readiness,"Insufficient manufacturing capacity and supply chain infrastructure for key DC components like cables and converters may lead to cost increases or delays in project timelines, impacting the scalability of DC solutions.",7,20260505_121738,no,False,1,1,,supply chain constraints,1,,gpt-5.4-mini,0.2,"Limited Supply Chain Readiness. Insufficient manufacturing capacity and supply chain infrastructure for key DC components like cables and converters may lead to cost increases or delays in project timelines, impacting the scalability of DC solutions.",10,1.0,technical,general,DC supply chain constraints
phi4-subject_matter_07_b3,phi4,phi4-subject_matter,subject_matter,phi4-subject_matter-enh:latest,Skill Gaps in Workforce,"A shortage of trained professionals skilled in designing, installing, and maintaining DC systems can slow adoption rates as companies struggle to find qualified personnel to support new technology deployments.",7,20260505_121738,no,False,1,1,,workforce skill shortage,1,,gpt-5.4-mini,0.2,"Skill Gaps in Workforce. A shortage of trained professionals skilled in designing, installing, and maintaining DC systems can slow adoption rates as companies struggle to find qualified personnel to support new technology deployments.",2,1.0,general,technical,Shortage in skilled workforce 
phi4-subject_matter_07_b4,phi4,phi4-subject_matter,subject_matter,phi4-subject_matter-enh:latest,Regulatory Uncertainty,"Inconsistent or evolving regulations across different regions regarding the use of DC technologies create uncertainty for stakeholders, making it difficult to plan long-term investments confidently.",7,20260505_121738,no,False,1,1,,regulatory uncertainty,1,,gpt-5.4-mini,0.2,"Regulatory Uncertainty. Inconsistent or evolving regulations across different regions regarding the use of DC technologies create uncertainty for stakeholders, making it difficult to plan long-term investments confidently.",3,1.0,policy,general,Regulatory uncertainty and hurdles
phi4-subject_matter_07_b5,phi4,phi4-subject_matter,subject_matter,phi4-subject_matter-enh:latest,Perceived Reliability Concerns,"Perceptions that AC systems are more reliable due to their historical prevalence can lead to reluctance in adopting DC solutions, despite advancements proving their robustness and efficiency in specific applications.",7,20260505_121738,no,False,1,1,,reliability perceptions,1,,gpt-5.4-mini,0.2,"Perceived Reliability Concerns. Perceptions that AC systems are more reliable due to their historical prevalence can lead to reluctance in adopting DC solutions, despite advancements proving their robustness and efficiency in specific applications.",11,1.0,technical,general,DC component cost and availability
phi4-subject_matter2_07_b1,phi4,phi4-subject_matter2,subject_matter,phi4-subject_matter2-enh:latest,Interoperability Challenges,"Integrating DC systems with existing AC infrastructure can be complex due to differences in standards, equipment compatibility, and system design. This may lead to increased costs and technical hurdles during the transition phase.",7,20260505_121738,no,False,1,1,,system integration complexity,1,,gpt-5.4-mini,0.2,"Interoperability Challenges. Integrating DC systems with existing AC infrastructure can be complex due to differences in standards, equipment compatibility, and system design. This may lead to increased costs and technical hurdles during the transition phase.",13,1.0,technical,general,Interoperability challenges with existing AC infrastructure
phi4-subject_matter2_07_b2,phi4,phi4-subject_matter2,subject_matter,phi4-subject_matter2-enh:latest,Limited Workforce Expertise,"There is a current shortage of skilled professionals who are trained specifically in DC technologies, which could slow down project implementation and maintenance efforts, impacting deployment timelines and effectiveness.",7,20260505_121738,no,False,1,1,,skills shortage,1,,gpt-5.4-mini,0.2,"Limited Workforce Expertise. There is a current shortage of skilled professionals who are trained specifically in DC technologies, which could slow down project implementation and maintenance efforts, impacting deployment timelines and effectiveness.",2,1.0,general,technical,Shortage in skilled workforce 
phi4-subject_matter2_07_b3,phi4,phi4-subject_matter2,subject_matter,phi4-subject_matter2-enh:latest,Economic Viability Concerns,"The initial capital investment required for deploying DC systems can be substantial. Without clear long-term economic benefits or incentives, stakeholders may hesitate to adopt these technologies over established AC systems.",7,20260505_121738,no,False,1,1,,high upfront costs,1,,gpt-5.4-mini,0.2,"Economic Viability Concerns. The initial capital investment required for deploying DC systems can be substantial. Without clear long-term economic benefits or incentives, stakeholders may hesitate to adopt these technologies over established AC systems.",9,1.0,general,technical,High upfront transition costs
phi4-subject_matter2_07_b4,phi4,phi4-subject_matter2,subject_matter,phi4-subject_matter2-enh:latest,Regulatory and Policy Uncertainty,The lack of harmonized regulations and standards at national and international levels creates uncertainty and potential legal challenges for the implementation of DC technologies across different regions.,7,20260505_121738,no,False,1,1,,regulatory uncertainty,1,,gpt-5.4-mini,0.2,Regulatory and Policy Uncertainty. The lack of harmonized regulations and standards at national and international levels creates uncertainty and potential legal challenges for the implementation of DC technologies across different regions.,3,1.0,policy,general,Regulatory uncertainty and hurdles
phi4-subject_matter2_07_b5,phi4,phi4-subject_matter2,subject_matter,phi4-subject_matter2-enh:latest,Public Perception and Acceptance,"Limited public understanding and acceptance of DC technologies can hinder their adoption. Misconceptions about safety, reliability, or benefits may need to be addressed through education and awareness initiatives.",7,20260505_121738,no,False,1,1,,public awareness,1,,gpt-5.4-mini,0.2,"Public Perception and Acceptance. Limited public understanding and acceptance of DC technologies can hinder their adoption. Misconceptions about safety, reliability, or benefits may need to be addressed through education and awareness initiatives.",14,0.9713471430081528,policy,general,Public awareness and acceptance
gemma3-generalist_07_b1,gemma3:12b,gemma3-generalist,generalist,gemma-generalist-enh:latest,Lack of Standardized Component Availability,"Limited availability of readily accessible, certified DC components beyond converters hinders scalability and increases project costs.",7,20260505_121738,no,False,2,2,,component supply constraints,1,,gpt-5.4-mini,0.2,"Lack of Standardized Component Availability. Limited availability of readily accessible, certified DC components beyond converters hinders scalability and increases project costs.",11,1.0,technical,general,DC component cost and availability
gemma3-generalist_07_b2,gemma3:12b,gemma3-generalist,generalist,gemma-generalist-enh:latest,Retrofit Integration Costs,Replacing existing AC infrastructure with DC in brownfield sites is significantly more expensive and disruptive than new builds.,7,20260505_121738,no,False,2,2,,retrofit cost burden,1,,gpt-5.4-mini,0.2,Retrofit Integration Costs. Replacing existing AC infrastructure with DC in brownfield sites is significantly more expensive and disruptive than new builds.,12,1.0,technical,general,Retrofit complexity in existing infrastructure
gemma3-generalist_07_b3,gemma3:12b,gemma3-generalist,generalist,gemma-generalist-enh:latest,Workforce Skill Gap,Insufficiently trained electrical engineers and technicians familiar with DC systems will impede installation and maintenance.,7,20260505_121738,no,False,2,2,,dc workforce training gap,1,,gpt-5.4-mini,0.2,Workforce Skill Gap. Insufficiently trained electrical engineers and technicians familiar with DC systems will impede installation and maintenance.,2,1.0,general,technical,Shortage in skilled workforce 
gemma3-generalist_07_b4,gemma3:12b,gemma3-generalist,generalist,gemma-generalist-enh:latest,Cybersecurity Vulnerabilities,"DC microgrids, with their increased connectivity, present novel cybersecurity risks requiring specialized protection strategies.",7,20260505_121738,no,False,2,2,,cybersecurity risks,1,,gpt-5.4-mini,0.2,"Cybersecurity Vulnerabilities. DC microgrids, with their increased connectivity, present novel cybersecurity risks requiring specialized protection strategies.",1,0.7648940644965384,technical,policy,Cybersecurity vulnerabilities in DC microgrids
gemma3-generalist_07_b5,gemma3:12b,gemma3-generalist,generalist,gemma-generalist-enh:latest,Interoperability Concerns,Lack of standardized communication protocols between diverse DC components from different manufacturers limits system integration.,7,20260505_121738,no,False,2,2,,protocol standardization,1,,gpt-5.4-mini,0.2,Interoperability Concerns. Lack of standardized communication protocols between diverse DC components from different manufacturers limits system integration.,4,1.0,technical,policy,DC interoperability standardization and cartification gap
gemma3-generalist2_07_b1,gemma3:12b,gemma3-generalist2,generalist,gemma-generalist2-enh:latest,Lack of Standardized Safety Protocols,"Current safety standards are heavily geared towards AC systems. Adapting or creating new, comprehensive safety protocols specifically for DC systems, particularly at low and medium voltage, will be essential and time-consuming.",7,20260505_121738,no,False,2,2,,dc safety standards,1,,gpt-5.4-mini,0.2,"Lack of Standardized Safety Protocols. Current safety standards are heavily geared towards AC systems. Adapting or creating new, comprehensive safety protocols specifically for DC systems, particularly at low and medium voltage, will be essential and time-consuming.",0,1.0,technical,policy,Gap in DC components safety standards 
gemma3-generalist2_07_b2,gemma3:12b,gemma3-generalist2,generalist,gemma-generalist2-enh:latest,Interoperability Concerns,The fragmented nature of early-stage DC component manufacturers and lack of common communication protocols will hinder seamless integration of diverse solutions and create compatibility issues.,7,20260505_121738,no,False,2,2,,compatibility issues,1,,gpt-5.4-mini,0.2,Interoperability Concerns. The fragmented nature of early-stage DC component manufacturers and lack of common communication protocols will hinder seamless integration of diverse solutions and create compatibility issues.,4,1.0,technical,policy,DC interoperability standardization and cartification gap
gemma3-generalist2_07_b3,gemma3:12b,gemma3-generalist2,generalist,gemma-generalist2-enh:latest,Retrofit Costs & Disruptions,"Replacing existing AC infrastructure with DC solutions in existing buildings or industrial facilities will be prohibitively expensive and disruptive, limiting adoption to new construction.",7,20260505_121738,no,False,2,2,,retrofit cost and disruption,1,,gpt-5.4-mini,0.2,"Retrofit Costs & Disruptions. Replacing existing AC infrastructure with DC solutions in existing buildings or industrial facilities will be prohibitively expensive and disruptive, limiting adoption to new construction.",12,1.0,technical,general,Retrofit complexity in existing infrastructure
gemma3-generalist2_07_b4,gemma3:12b,gemma3-generalist2,generalist,gemma-generalist2-enh:latest,Skill Gap in Installation & Maintenance,Electricians and maintenance personnel are primarily trained on AC systems. A significant investment in training and upskilling the workforce will be required.,7,20260505_121738,no,False,2,2,,workforce training gap,1,,gpt-5.4-mini,0.2,Skill Gap in Installation & Maintenance. Electricians and maintenance personnel are primarily trained on AC systems. A significant investment in training and upskilling the workforce will be required.,2,1.0,general,technical,Shortage in skilled workforce 
gemma3-generalist2_07_b5,gemma3:12b,gemma3-generalist2,generalist,gemma-generalist2-enh:latest,"Public Perception & ""Fear of the Unknown""","General public apprehension towards a less familiar technology like DC, potentially fueled by safety concerns or misinformation, could slow down acceptance and adoption.",7,20260505_121738,no,False,2,2,,public apprehension,1,,gpt-5.4-mini,0.2,"Public Perception & ""Fear of the Unknown"". General public apprehension towards a less familiar technology like DC, potentially fueled by safety concerns or misinformation, could slow down acceptance and adoption.",14,0.8610093858124196,policy,general,Public awareness and acceptance
gemma3-normative_07_b1,gemma3:12b,gemma3-normative,normative,gemma-normative-enh:latest,Lack of Standardized Component Safety Testing,"Current safety testing standards are primarily designed for AC systems. Adapting and validating these for DC components, particularly at low and medium voltage, requires significant development and certification costs, hindering widespread adoption.",7,20260505_121738,no,False,2,2,,dc safety certification costs,1,,gpt-5.4-mini,0.2,"Lack of Standardized Component Safety Testing. Current safety testing standards are primarily designed for AC systems. Adapting and validating these for DC components, particularly at low and medium voltage, requires significant development and certification costs, hindering widespread adoption.",0,0.4708282924690427,technical,policy,Gap in DC components safety standards 
gemma3-normative_07_b2,gemma3:12b,gemma3-normative,normative,gemma-normative-enh:latest,Limited Interoperability Concerns,"The diverse range of DC voltage levels and communication protocols being explored creates potential interoperability challenges between different manufacturers' equipment, potentially limiting system flexibility and integration.",7,20260505_121738,no,False,2,2,,interoperability challenges,1,,gpt-5.4-mini,0.2,"Limited Interoperability Concerns. The diverse range of DC voltage levels and communication protocols being explored creates potential interoperability challenges between different manufacturers' equipment, potentially limiting system flexibility and integration.",4,0.7907154681698022,technical,policy,DC interoperability standardization and cartification gap
gemma3-normative_07_b3,gemma3:12b,gemma3-normative,normative,gemma-normative-enh:latest,Retrofit Costs and Complexity,"Replacing existing AC infrastructure with DC systems in established buildings and industrial facilities is extremely expensive and disruptive, presenting a significant barrier to adoption beyond new construction projects.",7,20260505_121738,no,False,2,2,,retrofit cost complexity,1,,gpt-5.4-mini,0.2,"Retrofit Costs and Complexity. Replacing existing AC infrastructure with DC systems in established buildings and industrial facilities is extremely expensive and disruptive, presenting a significant barrier to adoption beyond new construction projects.",12,1.0,technical,general,Retrofit complexity in existing infrastructure
gemma3-normative_07_b4,gemma3:12b,gemma3-normative,normative,gemma-normative-enh:latest,Contractor Skill Gap,The relative lack of experience and training among electrical contractors in DC systems installation and maintenance creates a skills gap that increases project costs and risks.,7,20260505_121738,no,False,2,2,,contractor training gap,1,,gpt-5.4-mini,0.2,Contractor Skill Gap. The relative lack of experience and training among electrical contractors in DC systems installation and maintenance creates a skills gap that increases project costs and risks.,2,1.0,general,technical,Shortage in skilled workforce 
gemma3-normative_07_b5,gemma3:12b,gemma3-normative,normative,gemma-normative-enh:latest,Public Perception of Novelty & Safety,General public unfamiliarity and potential anxieties surrounding a shift from a well-established AC power system may create resistance and require extensive public education campaigns.,7,20260505_121738,no,False,2,2,,public acceptance concerns,1,,gpt-5.4-mini,0.2,Public Perception of Novelty & Safety. General public unfamiliarity and potential anxieties surrounding a shift from a well-established AC power system may create resistance and require extensive public education campaigns.,15,1.0,policy,technical,Public safety perception concerns
gemma3-normative2_07_b1,gemma3:12b,gemma3-normative2,normative,gemma-normative2-enh:latest,Harmonized Safety Standards,"Lack of universally accepted safety standards specifically for low and medium voltage DC systems creates uncertainty and hinders widespread adoption, particularly concerning arc flash and electrical shock hazards.",7,20260505_121738,no,False,2,2,,safety standard uncertainty,1,,gpt-5.4-mini,0.2,"Harmonized Safety Standards. Lack of universally accepted safety standards specifically for low and medium voltage DC systems creates uncertainty and hinders widespread adoption, particularly concerning arc flash and electrical shock hazards.",0,0.027925485031697,technical,policy,Gap in DC components safety standards 
gemma3-normative2_07_b2,gemma3:12b,gemma3-normative2,normative,gemma-normative2-enh:latest,Legacy Equipment Compatibility,"Integrating DC systems with existing AC infrastructure and legacy equipment presents significant technical and economic challenges, requiring costly retrofits or replacements.",7,20260505_121738,no,False,2,2,,legacy system integration,1,,gpt-5.4-mini,0.2,"Legacy Equipment Compatibility. Integrating DC systems with existing AC infrastructure and legacy equipment presents significant technical and economic challenges, requiring costly retrofits or replacements.",12,0.4320917663717109,technical,general,Retrofit complexity in existing infrastructure
gemma3-normative2_07_b3,gemma3:12b,gemma3-normative2,normative,gemma-normative2-enh:latest,Lack of Skilled Workforce,"A shortage of engineers and technicians with expertise in DC power systems design, installation, and maintenance limits deployment capacity and increases costs.",7,20260505_121738,no,False,2,2,,workforce skills shortage,1,,gpt-5.4-mini,0.2,"Lack of Skilled Workforce. A shortage of engineers and technicians with expertise in DC power systems design, installation, and maintenance limits deployment capacity and increases costs.",2,1.0,general,technical,Shortage in skilled workforce 
gemma3-normative2_07_b4,gemma3:12b,gemma3-normative2,normative,gemma-normative2-enh:latest,Cybersecurity Vulnerabilities,"DC microgrids, particularly those integrated with digital twins and IoT devices, introduce new cybersecurity risks requiring specialized protection measures.",7,20260505_121738,no,False,2,2,,cybersecurity risks,1,,gpt-5.4-mini,0.2,"Cybersecurity Vulnerabilities. DC microgrids, particularly those integrated with digital twins and IoT devices, introduce new cybersecurity risks requiring specialized protection measures.",1,0.6381953058264646,technical,policy,Cybersecurity vulnerabilities in DC microgrids
gemma3-normative2_07_b5,gemma3:12b,gemma3-normative2,normative,gemma-normative2-enh:latest,Long-Term Reliability Data,Limited long-term operational data on DC power components and systems creates uncertainty regarding their durability and reliability in diverse applications.,7,20260505_121738,no,False,2,2,,reliability uncertainty,1,,gpt-5.4-mini,0.2,Long-Term Reliability Data. Limited long-term operational data on DC power components and systems creates uncertainty regarding their durability and reliability in diverse applications.,11,1.0,technical,general,DC component cost and availability
gemma3-subject_matter_07_b1,gemma3:12b,gemma3-subject_matter,subject_matter,gemma-subject_matter-enh:latest,Lack of Standardized Component Availability,"Limited availability of readily accessible, certified DC components across various voltage levels hinders system design and increases project costs.",7,20260505_121738,no,False,2,2,,component availability,1,,gpt-5.4-mini,0.2,"Lack of Standardized Component Availability. Limited availability of readily accessible, certified DC components across various voltage levels hinders system design and increases project costs.",11,1.0,technical,general,DC component cost and availability
