row_id,base_model,variant_id,role,model,barrier_title,explanation,iteration,timestamp,truncated,is_duplicate,attempts,transport_attempts,transport_error,theme,theme_attempts,theme_error,theme_model,theme_temperature,cluster_text,cluster,cluster_prob,primary_category,secondary_category,human_labelled_clusters
phi4-subject_matter_02_b5,phi4,phi4-subject_matter,subject_matter,phi4-subject_matter-enh:latest,Public Perception and Awareness,Limited public understanding of the benefits and safety of DC systems can lead to resistance from end-users and stakeholders. Addressing misconceptions is crucial for gaining broader acceptance and support.,2,20260505_121738,no,False,1,1,,public awareness gaps,1,,gpt-5.4-mini,0.2,Public Perception and Awareness. Limited public understanding of the benefits and safety of DC systems can lead to resistance from end-users and stakeholders. Addressing misconceptions is crucial for gaining broader acceptance and support.,14,1.0,policy,general,Public awareness and acceptance
phi4-subject_matter2_02_b1,phi4,phi4-subject_matter2,subject_matter,phi4-subject_matter2-enh:latest,Interoperability Challenges,"The integration of DC systems with existing AC infrastructure poses significant technical challenges, as compatibility issues can arise. These may lead to inefficiencies or require costly adaptations in legacy systems that are predominantly designed for alternating current.",2,20260505_121738,no,False,1,1,,compatibility with legacy systems,1,,gpt-5.4-mini,0.2,"Interoperability Challenges. The integration of DC systems with existing AC infrastructure poses significant technical challenges, as compatibility issues can arise. These may lead to inefficiencies or require costly adaptations in legacy systems that are predominantly designed for alternating current.",13,1.0,technical,general,Interoperability challenges with existing AC infrastructure
phi4-subject_matter2_02_b2,phi4,phi4-subject_matter2,subject_matter,phi4-subject_matter2-enh:latest,Standardization Gaps,"A lack of universally accepted standards for DC voltage levels and components can hinder widespread adoption. Without standardization, manufacturers and consumers face uncertainty regarding system performance and compatibility, potentially slowing down deployment and innovation.",2,20260505_121738,no,False,1,1,,lack of standards,1,,gpt-5.4-mini,0.2,"Standardization Gaps. A lack of universally accepted standards for DC voltage levels and components can hinder widespread adoption. Without standardization, manufacturers and consumers face uncertainty regarding system performance and compatibility, potentially slowing down deployment and innovation.",6,1.0,general,technical,DC market readiness and standardization challenges
phi4-subject_matter2_02_b3,phi4,phi4-subject_matter2,subject_matter,phi4-subject_matter2-enh:latest,Skill Shortage in Workforce,"The shift to DC technologies necessitates a workforce skilled in new design, installation, and maintenance practices specific to DC systems. A shortage of such trained professionals can delay projects, increase costs, and affect the reliability of DC solutions.",2,20260505_121738,no,False,1,1,,workforce skill shortage,1,,gpt-5.4-mini,0.2,"Skill Shortage in Workforce. The shift to DC technologies necessitates a workforce skilled in new design, installation, and maintenance practices specific to DC systems. A shortage of such trained professionals can delay projects, increase costs, and affect the reliability of DC solutions.",2,1.0,general,technical,Shortage in skilled workforce 
phi4-subject_matter2_02_b4,phi4,phi4-subject_matter2,subject_matter,phi4-subject_matter2-enh:latest,Economic Viability Concerns,"Initial investment costs for transitioning to DC infrastructure can be prohibitive, especially for small businesses or regions with limited financial resources. The perceived economic risk may deter stakeholders from adopting DC technologies despite long-term benefits.",2,20260505_121738,no,False,1,1,,high upfront costs,1,,gpt-5.4-mini,0.2,"Economic Viability Concerns. Initial investment costs for transitioning to DC infrastructure can be prohibitive, especially for small businesses or regions with limited financial resources. The perceived economic risk may deter stakeholders from adopting DC technologies despite long-term benefits.",9,1.0,general,technical,High upfront transition costs
phi4-subject_matter2_02_b5,phi4,phi4-subject_matter2,subject_matter,phi4-subject_matter2-enh:latest,Consumer Awareness and Acceptance,"Public understanding of the advantages of DC systems is often limited, leading to resistance based on misconceptions or lack of information. Effective education campaigns are needed to build consumer confidence and acceptance, which is crucial for market penetration and adoption success.",2,20260505_121738,no,False,1,1,,consumer awareness,1,,gpt-5.4-mini,0.2,"Consumer Awareness and Acceptance. Public understanding of the advantages of DC systems is often limited, leading to resistance based on misconceptions or lack of information. Effective education campaigns are needed to build consumer confidence and acceptance, which is crucial for market penetration and adoption success.",14,1.0,policy,general,Public awareness and acceptance
gemma3-generalist_02_b1,gemma3:12b,gemma3-generalist,generalist,gemma-generalist-enh:latest,Lack of Standardized Interoperability,"Without universal standards for DC components and communication protocols, integration across different vendors and systems will be difficult, hindering scalability and increasing risk.",2,20260505_121738,no,False,2,2,,interoperability standards,1,,gpt-5.4-mini,0.2,"Lack of Standardized Interoperability. Without universal standards for DC components and communication protocols, integration across different vendors and systems will be difficult, hindering scalability and increasing risk.",4,1.0,technical,policy,DC interoperability standardization and cartification gap
gemma3-generalist_02_b2,gemma3:12b,gemma3-generalist,generalist,gemma-generalist-enh:latest,Limited Availability of Skilled Workforce,"A shortage of engineers and technicians with expertise in DC power systems will impede installation, maintenance, and troubleshooting.",2,20260505_121738,no,False,2,2,,skilled workforce shortage,1,,gpt-5.4-mini,0.2,"Limited Availability of Skilled Workforce. A shortage of engineers and technicians with expertise in DC power systems will impede installation, maintenance, and troubleshooting.",2,1.0,general,technical,Shortage in skilled workforce 
gemma3-generalist_02_b3,gemma3:12b,gemma3-generalist,generalist,gemma-generalist-enh:latest,Retrofit Costs & Complexity,"Adapting existing AC infrastructure to DC presents significant upfront costs and engineering challenges, particularly in older buildings and industrial facilities.",2,20260505_121738,no,False,2,2,,retrofit cost complexity,1,,gpt-5.4-mini,0.2,"Retrofit Costs & Complexity. Adapting existing AC infrastructure to DC presents significant upfront costs and engineering challenges, particularly in older buildings and industrial facilities.",12,1.0,technical,general,Retrofit complexity in existing infrastructure
gemma3-generalist_02_b4,gemma3:12b,gemma3-generalist,generalist,gemma-generalist-enh:latest,Safety Perceptions & Training,"Public and worker apprehension regarding the safety of DC systems, coupled with a need for specialized training, may slow adoption.",2,20260505_121738,no,False,2,2,,safety concerns,1,,gpt-5.4-mini,0.2,"Safety Perceptions & Training. Public and worker apprehension regarding the safety of DC systems, coupled with a need for specialized training, may slow adoption.",-1,0.0,,,
gemma3-generalist_02_b5,gemma3:12b,gemma3-generalist,generalist,gemma-generalist-enh:latest,Insurance & Liability Concerns,"Insurance providers may initially be hesitant to cover DC installations due to a lack of long-term performance data and established safety protocols, increasing project costs and delaying implementation.",2,20260505_121738,no,False,2,2,,insurance coverage uncertainty,1,,gpt-5.4-mini,0.2,"Insurance & Liability Concerns. Insurance providers may initially be hesitant to cover DC installations due to a lack of long-term performance data and established safety protocols, increasing project costs and delaying implementation.",-1,0.0,,,
gemma3-generalist2_02_b1,gemma3:12b,gemma3-generalist2,generalist,gemma-generalist2-enh:latest,Lack of Standardized Component Availability,"Limited availability of readily accessible, certified DC components beyond core converters hinders scalability and increases project costs.",2,20260505_121738,no,False,2,2,,component supply constraints,1,,gpt-5.4-mini,0.2,"Lack of Standardized Component Availability. Limited availability of readily accessible, certified DC components beyond core converters hinders scalability and increases project costs.",11,1.0,technical,general,DC component cost and availability
gemma3-generalist2_02_b2,gemma3:12b,gemma3-generalist2,generalist,gemma-generalist2-enh:latest,Cybersecurity Vulnerabilities in DC Microgrids,"DC microgrids, with their distributed nature, present unique cybersecurity challenges requiring specialized protection and monitoring systems.",2,20260505_121738,no,False,2,2,,cybersecurity challenges,1,,gpt-5.4-mini,0.2,"Cybersecurity Vulnerabilities in DC Microgrids. DC microgrids, with their distributed nature, present unique cybersecurity challenges requiring specialized protection and monitoring systems.",1,1.0,technical,policy,Cybersecurity vulnerabilities in DC microgrids
gemma3-generalist2_02_b3,gemma3:12b,gemma3-generalist2,generalist,gemma-generalist2-enh:latest,Interoperability Concerns Across DC Systems,Lack of standardized communication protocols between different DC systems and manufacturers can create integration headaches.,2,20260505_121738,no,False,2,2,,integration standards gaps,1,,gpt-5.4-mini,0.2,Interoperability Concerns Across DC Systems. Lack of standardized communication protocols between different DC systems and manufacturers can create integration headaches.,4,1.0,technical,policy,DC interoperability standardization and cartification gap
gemma3-generalist2_02_b4,gemma3:12b,gemma3-generalist2,generalist,gemma-generalist2-enh:latest,Impact on Existing Grid Infrastructure,"Retrofitting DC systems into existing AC grids requires careful planning and potential upgrades, adding complexity and cost.",2,20260505_121738,no,False,2,2,,grid retrofit complexity,1,,gpt-5.4-mini,0.2,"Impact on Existing Grid Infrastructure. Retrofitting DC systems into existing AC grids requires careful planning and potential upgrades, adding complexity and cost.",7,0.7520898017984846,technical,general,AC grid integration complexity
gemma3-generalist2_02_b5,gemma3:12b,gemma3-generalist2,generalist,gemma-generalist2-enh:latest,Limited Skilled Workforce,"A shortage of engineers and technicians with expertise in DC systems design, installation, and maintenance poses a significant barrier.",2,20260505_121738,no,False,2,2,,skilled labor shortage,1,,gpt-5.4-mini,0.2,"Limited Skilled Workforce. A shortage of engineers and technicians with expertise in DC systems design, installation, and maintenance poses a significant barrier.",2,1.0,general,technical,Shortage in skilled workforce 
gemma3-normative_02_b1,gemma3:12b,gemma3-normative,normative,gemma-normative-enh:latest,Lack of Standardized Component Interoperability,"Currently, DC component manufacturers operate with limited standardization, leading to interoperability challenges and hindering system integration.",2,20260505_121738,no,False,2,2,,interoperability standards,1,,gpt-5.4-mini,0.2,"Lack of Standardized Component Interoperability. Currently, DC component manufacturers operate with limited standardization, leading to interoperability challenges and hindering system integration.",4,1.0,technical,policy,DC interoperability standardization and cartification gap
gemma3-normative_02_b2,gemma3:12b,gemma3-normative,normative,gemma-normative-enh:latest,Limited Availability of Skilled Installers & Maintainers,The scarcity of personnel trained in DC system installation and maintenance presents a significant bottleneck for widespread deployment.,2,20260505_121738,no,False,2,2,,skilled labor shortage,1,,gpt-5.4-mini,0.2,Limited Availability of Skilled Installers & Maintainers. The scarcity of personnel trained in DC system installation and maintenance presents a significant bottleneck for widespread deployment.,2,1.0,general,technical,Shortage in skilled workforce 
gemma3-normative_02_b3,gemma3:12b,gemma3-normative,normative,gemma-normative-enh:latest,Legacy Infrastructure Compatibility Issues,"Retrofitting existing AC infrastructure with DC systems is complex and costly, limiting adoption in brownfield projects.",2,20260505_121738,no,False,2,2,,retrofit complexity,1,,gpt-5.4-mini,0.2,"Legacy Infrastructure Compatibility Issues. Retrofitting existing AC infrastructure with DC systems is complex and costly, limiting adoption in brownfield projects.",12,0.8947044058503313,technical,general,Retrofit complexity in existing infrastructure
gemma3-normative_02_b4,gemma3:12b,gemma3-normative,normative,gemma-normative-enh:latest,Cybersecurity Vulnerabilities in DC Microgrids,"DC microgrids, with their distributed nature, introduce new cybersecurity risks that require specialized mitigation strategies.",2,20260505_121738,no,False,2,2,,cybersecurity risks,1,,gpt-5.4-mini,0.2,"Cybersecurity Vulnerabilities in DC Microgrids. DC microgrids, with their distributed nature, introduce new cybersecurity risks that require specialized mitigation strategies.",1,1.0,technical,policy,Cybersecurity vulnerabilities in DC microgrids
gemma3-normative_02_b5,gemma3:12b,gemma3-normative,normative,gemma-normative-enh:latest,Public Perception of Safety and Reliability,"Concerns about the safety and reliability of DC systems, particularly among the general public, can impede acceptance and adoption.",2,20260505_121738,no,False,2,2,,safety and reliability concerns,1,,gpt-5.4-mini,0.2,"Public Perception of Safety and Reliability. Concerns about the safety and reliability of DC systems, particularly among the general public, can impede acceptance and adoption.",15,0.8804581076705699,policy,technical,Public safety perception concerns
gemma3-normative2_02_b1,gemma3:12b,gemma3-normative2,normative,gemma-normative2-enh:latest,Lack of Standardized Component Safety Testing,Current safety testing standards are largely geared towards AC systems. A lack of DC-specific safety testing protocols creates uncertainty and potential liability concerns for manufacturers and users.,2,20260505_121738,no,False,2,2,,dc safety testing standards,1,,gpt-5.4-mini,0.2,Lack of Standardized Component Safety Testing. Current safety testing standards are largely geared towards AC systems. A lack of DC-specific safety testing protocols creates uncertainty and potential liability concerns for manufacturers and users.,0,0.4708282924690427,technical,policy,Gap in DC components safety standards 
gemma3-normative2_02_b2,gemma3:12b,gemma3-normative2,normative,gemma-normative2-enh:latest,Limited Interoperability Standards,"While guidelines are being developed, a lack of widely adopted interoperability standards between different DC components and systems hinders seamless integration and scalability.",2,20260505_121738,no,False,2,2,,interoperability standards gap,1,,gpt-5.4-mini,0.2,"Limited Interoperability Standards. While guidelines are being developed, a lack of widely adopted interoperability standards between different DC components and systems hinders seamless integration and scalability.",4,1.0,technical,policy,DC interoperability standardization and cartification gap
gemma3-normative2_02_b3,gemma3:12b,gemma3-normative2,normative,gemma-normative2-enh:latest,Retrofit Costs & Disruptions,"Integrating DC into existing AC infrastructure (e.g., buildings, factories) can be prohibitively expensive and disruptive, limiting adoption to new construction or major renovations.",2,20260505_121738,no,False,2,2,,retrofit cost barriers,1,,gpt-5.4-mini,0.2,"Retrofit Costs & Disruptions. Integrating DC into existing AC infrastructure (e.g., buildings, factories) can be prohibitively expensive and disruptive, limiting adoption to new construction or major renovations.",12,1.0,technical,general,Retrofit complexity in existing infrastructure
gemma3-normative2_02_b4,gemma3:12b,gemma3-normative2,normative,gemma-normative2-enh:latest,Workforce Skill Gap,"A shortage of trained professionals familiar with DC system design, installation, and maintenance poses a significant barrier to widespread adoption and reliable operation.",2,20260505_121738,no,False,2,2,,skilled labor shortage,1,,gpt-5.4-mini,0.2,"Workforce Skill Gap. A shortage of trained professionals familiar with DC system design, installation, and maintenance poses a significant barrier to widespread adoption and reliable operation.",2,1.0,general,technical,Shortage in skilled workforce 
gemma3-normative2_02_b5,gemma3:12b,gemma3-normative2,normative,gemma-normative2-enh:latest,Public Perception & Safety Concerns,"Despite potential benefits, public apprehension regarding the safety and reliability of DC systems, particularly concerning electrical hazards, needs to be addressed through education and transparent communication.",2,20260505_121738,no,False,2,2,,safety concerns,1,,gpt-5.4-mini,0.2,"Public Perception & Safety Concerns. Despite potential benefits, public apprehension regarding the safety and reliability of DC systems, particularly concerning electrical hazards, needs to be addressed through education and transparent communication.",15,1.0,policy,technical,Public safety perception concerns
gemma3-subject_matter_02_b1,gemma3:12b,gemma3-subject_matter,subject_matter,gemma-subject_matter-enh:latest,Retrofit Costs,"Replacing existing AC infrastructure with DC is prohibitively expensive for many facilities, hindering adoption beyond greenfield projects.",2,20260505_121738,no,False,2,2,,high retrofit costs,1,,gpt-5.4-mini,0.2,"Retrofit Costs. Replacing existing AC infrastructure with DC is prohibitively expensive for many facilities, hindering adoption beyond greenfield projects.",12,1.0,technical,general,Retrofit complexity in existing infrastructure
gemma3-subject_matter_02_b2,gemma3:12b,gemma3-subject_matter,subject_matter,gemma-subject_matter-enh:latest,Lack of Standardized Component Availability,"While components exist, a lack of readily available, standardized DC components across voltage levels and functionalities creates supply chain challenges and limits design flexibility.",2,20260505_121738,no,False,2,2,,standardized component availability,1,,gpt-5.4-mini,0.2,"Lack of Standardized Component Availability. While components exist, a lack of readily available, standardized DC components across voltage levels and functionalities creates supply chain challenges and limits design flexibility.",11,1.0,technical,general,DC component cost and availability
gemma3-subject_matter_02_b3,gemma3:12b,gemma3-subject_matter,subject_matter,gemma-subject_matter-enh:latest,Skilled Workforce Gap,"A shortage of engineers and technicians with expertise in DC systems design, installation, and maintenance poses a significant barrier to widespread implementation.",2,20260505_121738,no,False,2,2,,workforce skills shortage,1,,gpt-5.4-mini,0.2,"Skilled Workforce Gap. A shortage of engineers and technicians with expertise in DC systems design, installation, and maintenance poses a significant barrier to widespread implementation.",2,1.0,general,technical,Shortage in skilled workforce 
gemma3-subject_matter_02_b4,gemma3:12b,gemma3-subject_matter,subject_matter,gemma-subject_matter-enh:latest,Interoperability Concerns,"Ensuring seamless interoperability between diverse DC components from different vendors, particularly in complex systems, remains a technical challenge.",2,20260505_121738,no,False,2,2,,vendor interoperability challenges,1,,gpt-5.4-mini,0.2,"Interoperability Concerns. Ensuring seamless interoperability between diverse DC components from different vendors, particularly in complex systems, remains a technical challenge.",4,1.0,technical,policy,DC interoperability standardization and cartification gap
gemma3-subject_matter_02_b5,gemma3:12b,gemma3-subject_matter,subject_matter,gemma-subject_matter-enh:latest,Electromagnetic Interference (EMI) Mitigation,"DC systems can be more susceptible to EMI, requiring careful design and shielding to prevent interference with other equipment and maintain system reliability.",2,20260505_121738,no,False,2,2,,emi shielding,1,,gpt-5.4-mini,0.2,"Electromagnetic Interference (EMI) Mitigation. DC systems can be more susceptible to EMI, requiring careful design and shielding to prevent interference with other equipment and maintain system reliability.",-1,0.0,,,
gemma3-subject_matter2_02_b1,gemma3:12b,gemma3-subject_matter2,subject_matter,gemma-subject_matter2-enh:latest,Lack of Standardized Component Availability,"Limited availability of readily accessible, certified DC components (breakers, transformers, specialized cables) outside of HVDC applications hinders scalability and increases project costs.",2,20260505_121738,no,False,2,2,,component supply shortage,1,,gpt-5.4-mini,0.2,"Lack of Standardized Component Availability. Limited availability of readily accessible, certified DC components (breakers, transformers, specialized cables) outside of HVDC applications hinders scalability and increases project costs.",11,1.0,technical,general,DC component cost and availability
gemma3-subject_matter2_02_b2,gemma3:12b,gemma3-subject_matter2,subject_matter,gemma-subject_matter2-enh:latest,Cybersecurity Vulnerabilities in DC Microgrids,"DC microgrids, especially those integrating renewable sources and edge computing, present unique cybersecurity challenges requiring specialized protection and monitoring systems.",2,20260505_121738,no,False,2,2,,cybersecurity risks,1,,gpt-5.4-mini,0.2,"Cybersecurity Vulnerabilities in DC Microgrids. DC microgrids, especially those integrating renewable sources and edge computing, present unique cybersecurity challenges requiring specialized protection and monitoring systems.",1,1.0,technical,policy,Cybersecurity vulnerabilities in DC microgrids
gemma3-subject_matter2_02_b3,gemma3:12b,gemma3-subject_matter2,subject_matter,gemma-subject_matter2-enh:latest,Interoperability with Existing AC Infrastructure,"Seamless integration of DC systems with existing AC grids and equipment requires complex power conversion and synchronization strategies, adding complexity and potential points of failure.",2,20260505_121738,no,False,2,2,,integration complexity,1,,gpt-5.4-mini,0.2,"Interoperability with Existing AC Infrastructure. Seamless integration of DC systems with existing AC grids and equipment requires complex power conversion and synchronization strategies, adding complexity and potential points of failure.",13,0.7119782082454463,technical,general,Interoperability challenges with existing AC infrastructure
gemma3-subject_matter2_02_b4,gemma3:12b,gemma3-subject_matter2,subject_matter,gemma-subject_matter2-enh:latest,Skill Gap in DC System Design & Maintenance,"A shortage of qualified engineers and technicians experienced in DC system design, commissioning, and maintenance poses a significant barrier to widespread adoption.",2,20260505_121738,no,False,2,2,,workforce skill shortage,1,,gpt-5.4-mini,0.2,"Skill Gap in DC System Design & Maintenance. A shortage of qualified engineers and technicians experienced in DC system design, commissioning, and maintenance poses a significant barrier to widespread adoption.",2,1.0,general,technical,Shortage in skilled workforce 
gemma3-subject_matter2_02_b5,gemma3:12b,gemma3-subject_matter2,subject_matter,gemma-subject_matter2-enh:latest,Public Perception & Safety Concerns,"Lack of public awareness and potential safety concerns related to DC systems (e.g., higher voltage potentials) could lead to resistance and require extensive public education campaigns.",2,20260505_121738,no,False,2,2,,public safety concerns,1,,gpt-5.4-mini,0.2,"Public Perception & Safety Concerns. Lack of public awareness and potential safety concerns related to DC systems (e.g., higher voltage potentials) could lead to resistance and require extensive public education campaigns.",15,1.0,policy,technical,Public safety perception concerns
phi4-generalist_03_b1,phi4,phi4-generalist,generalist,phi4-generalist-enh:latest,Cultural Resistance and Knowledge Gap,"Many stakeholders, including consumers and small businesses, may lack awareness or understanding of direct current (DC) benefits compared to traditional alternating current (AC) systems. This knowledge gap can lead to cultural resistance against adopting new technologies, slowing down the transition.",3,20260505_121738,no,False,1,1,,awareness and cultural resistance,1,,gpt-5.4-mini,0.2,"Cultural Resistance and Knowledge Gap. Many stakeholders, including consumers and small businesses, may lack awareness or understanding of direct current (DC) benefits compared to traditional alternating current (AC) systems. This knowledge gap can lead to cultural resistance against adopting new technologies, slowing down the transition.",-1,0.0,,,
