row_id,base_model,variant_id,role,model,barrier_title,explanation,iteration,timestamp,truncated,is_duplicate,attempts,transport_attempts,transport_error,theme,theme_attempts,theme_error,theme_model,theme_temperature,cluster_text,cluster,cluster_prob,primary_category,secondary_category,human_labelled_clusters
phi4-generalist_00_b1,phi4,phi4-generalist,generalist,phi4-generalist-enh:latest,Interoperability Challenges,"The lack of standardized protocols for integrating DC systems with existing AC infrastructure can hinder seamless interoperability, leading to increased costs and complexity during deployment.",0,20260505_121738,no,False,1,1,,integration compatibility issues,1,,gpt-5.4-mini,0.2,"Interoperability Challenges. The lack of standardized protocols for integrating DC systems with existing AC infrastructure can hinder seamless interoperability, leading to increased costs and complexity during deployment.",13,1.0,technical,general,Interoperability challenges with existing AC infrastructure
phi4-generalist_00_b2,phi4,phi4-generalist,generalist,phi4-generalist-enh:latest,Grid Stability Concerns,"Transitioning parts of the grid to DC could introduce instability issues, as current infrastructure is predominantly designed for AC. This requires sophisticated control mechanisms to maintain reliability.",0,20260505_121738,no,False,1,1,,grid stability,1,,gpt-5.4-mini,0.2,"Grid Stability Concerns. Transitioning parts of the grid to DC could introduce instability issues, as current infrastructure is predominantly designed for AC. This requires sophisticated control mechanisms to maintain reliability.",7,1.0,technical,general,AC grid integration complexity
phi4-generalist_00_b3,phi4,phi4-generalist,generalist,phi4-generalist-enh:latest,Economic Viability Hurdles,"The initial investment required for DC technology can be prohibitive, especially when compared to established AC systems. Without clear economic incentives or subsidies, adoption may lag due to cost concerns.",0,20260505_121738,no,False,1,1,,high upfront costs,1,,gpt-5.4-mini,0.2,"Economic Viability Hurdles. The initial investment required for DC technology can be prohibitive, especially when compared to established AC systems. Without clear economic incentives or subsidies, adoption may lag due to cost concerns.",9,1.0,general,technical,High upfront transition costs
phi4-generalist_00_b4,phi4,phi4-generalist,generalist,phi4-generalist-enh:latest,Skill and Knowledge Gaps,"There is a shortage of professionals trained in DC technologies, which could slow down implementation efforts. Comprehensive training programs are necessary to build the required workforce expertise.",0,20260505_121738,no,False,1,1,,workforce training gaps,1,,gpt-5.4-mini,0.2,"Skill and Knowledge Gaps. There is a shortage of professionals trained in DC technologies, which could slow down implementation efforts. Comprehensive training programs are necessary to build the required workforce expertise.",2,1.0,general,technical,Shortage in skilled workforce 
phi4-generalist_00_b5,phi4,phi4-generalist,generalist,phi4-generalist-enh:latest,Public Perception and Acceptance,"Limited public understanding or awareness of the benefits of DC systems can result in resistance or indifference towards adoption, necessitating targeted education and communication strategies to gain public support.",0,20260505_121738,no,False,1,1,,public awareness gap,1,,gpt-5.4-mini,0.2,"Public Perception and Acceptance. Limited public understanding or awareness of the benefits of DC systems can result in resistance or indifference towards adoption, necessitating targeted education and communication strategies to gain public support.",14,0.9926877080258658,policy,general,Public awareness and acceptance
phi4-generalist2_00_b1,phi4,phi4-generalist2,generalist,phi4-generalist2-enh:latest,Interoperability Challenges,"As DC technologies integrate into existing AC systems, ensuring seamless interoperability can be complex. Differences in standards and protocols across regions and industries may hinder the adoption of DC solutions.",0,20260505_121738,no,False,1,1,,standards compatibility issues,1,,gpt-5.4-mini,0.2,"Interoperability Challenges. As DC technologies integrate into existing AC systems, ensuring seamless interoperability can be complex. Differences in standards and protocols across regions and industries may hinder the adoption of DC solutions.",13,1.0,technical,general,Interoperability challenges with existing AC infrastructure
phi4-generalist2_00_b2,phi4,phi4-generalist2,generalist,phi4-generalist2-enh:latest,Supply Chain Constraints,"The current supply chain is predominantly optimized for AC components. Transitioning to a DC-focused supply chain requires retooling manufacturers and suppliers, which can delay adoption and increase initial costs.",0,20260505_121738,no,False,1,1,,supply chain retooling,1,,gpt-5.4-mini,0.2,"Supply Chain Constraints. The current supply chain is predominantly optimized for AC components. Transitioning to a DC-focused supply chain requires retooling manufacturers and suppliers, which can delay adoption and increase initial costs.",10,0.8825189471067735,technical,general,DC supply chain constraints
phi4-generalist2_00_b3,phi4,phi4-generalist2,generalist,phi4-generalist2-enh:latest,Economic Uncertainty,Fluctuating energy prices and uncertain economic conditions may deter investment in new technologies like DC systems. Companies might be hesitant to commit resources without clear long-term financial benefits.,0,20260505_121738,no,False,1,1,,investment risk,1,,gpt-5.4-mini,0.2,Economic Uncertainty. Fluctuating energy prices and uncertain economic conditions may deter investment in new technologies like DC systems. Companies might be hesitant to commit resources without clear long-term financial benefits.,8,1.0,general,policy,Economic uncertainty and ROI
phi4-generalist2_00_b4,phi4,phi4-generalist2,generalist,phi4-generalist2-enh:latest,Lack of Skilled Workforce,"There is a shortage of professionals trained specifically in DC technology installation, maintenance, and troubleshooting. This skills gap can slow down the deployment and efficient operation of DC systems.",0,20260505_121738,no,False,1,1,,workforce skills shortage,1,,gpt-5.4-mini,0.2,"Lack of Skilled Workforce. There is a shortage of professionals trained specifically in DC technology installation, maintenance, and troubleshooting. This skills gap can slow down the deployment and efficient operation of DC systems.",2,0.8551739312587656,general,technical,Shortage in skilled workforce 
phi4-generalist2_00_b5,phi4,phi4-generalist2,generalist,phi4-generalist2-enh:latest,Data Security Concerns,"As DC systems increasingly rely on digital tools and platforms for monitoring and control, concerns about data security and privacy arise. Ensuring robust cybersecurity measures is essential to gain stakeholder trust.",0,20260505_121738,no,False,1,1,,cybersecurity concerns,1,,gpt-5.4-mini,0.2,"Data Security Concerns. As DC systems increasingly rely on digital tools and platforms for monitoring and control, concerns about data security and privacy arise. Ensuring robust cybersecurity measures is essential to gain stakeholder trust.",1,0.327648930783479,technical,policy,Cybersecurity vulnerabilities in DC microgrids
phi4-normative_00_b1,phi4,phi4-normative,normative,phi4-normative-enh:latest,Integration with Existing AC Infrastructure,"Integrating DC systems into existing predominantly AC-based infrastructure poses significant technical challenges, requiring substantial retrofitting and coordination across various sectors.",0,20260505_121738,no,False,1,1,,ac infrastructure integration,1,,gpt-5.4-mini,0.2,"Integration with Existing AC Infrastructure. Integrating DC systems into existing predominantly AC-based infrastructure poses significant technical challenges, requiring substantial retrofitting and coordination across various sectors.",13,1.0,technical,general,Interoperability challenges with existing AC infrastructure
phi4-normative_00_b2,phi4,phi4-normative,normative,phi4-normative-enh:latest,Lack of Standardization,"The absence of universally accepted standards for DC technologies hampers interoperability between different manufacturers' equipment, complicating implementation and scalability.",0,20260505_121738,no,False,1,1,,interoperability standards,1,,gpt-5.4-mini,0.2,"Lack of Standardization. The absence of universally accepted standards for DC technologies hampers interoperability between different manufacturers' equipment, complicating implementation and scalability.",5,1.0,general,technical,DC market readiness and standardization challenges
phi4-normative_00_b3,phi4,phi4-normative,normative,phi4-normative-enh:latest,High Initial Investment Costs,"Transitioning to DC systems involves considerable upfront costs in terms of new hardware, training, and system redesigns, which can deter adoption despite potential long-term savings.",0,20260505_121738,no,False,1,1,,upfront investment costs,1,,gpt-5.4-mini,0.2,"High Initial Investment Costs. Transitioning to DC systems involves considerable upfront costs in terms of new hardware, training, and system redesigns, which can deter adoption despite potential long-term savings.",9,1.0,general,technical,High upfront transition costs
phi4-normative_00_b4,phi4,phi4-normative,normative,phi4-normative-enh:latest,Knowledge and Skill Gaps,"A shortage of skilled professionals with expertise in DC technologies limits the capacity for effective implementation and maintenance, necessitating extensive education and training programs.",0,20260505_121738,no,False,1,1,,workforce skill shortage,1,,gpt-5.4-mini,0.2,"Knowledge and Skill Gaps. A shortage of skilled professionals with expertise in DC technologies limits the capacity for effective implementation and maintenance, necessitating extensive education and training programs.",2,1.0,general,technical,Shortage in skilled workforce 
phi4-normative_00_b5,phi4,phi4-normative,normative,phi4-normative-enh:latest,Regulatory Uncertainty,"The evolving nature of regulations surrounding DC systems creates uncertainty for stakeholders, complicating compliance efforts and potentially delaying adoption due to unclear legal frameworks.",0,20260505_121738,no,False,1,1,,regulatory uncertainty,1,,gpt-5.4-mini,0.2,"Regulatory Uncertainty. The evolving nature of regulations surrounding DC systems creates uncertainty for stakeholders, complicating compliance efforts and potentially delaying adoption due to unclear legal frameworks.",3,1.0,policy,general,Regulatory uncertainty and hurdles
phi4-normative2_00_b1,phi4,phi4-normative2,normative,phi4-normative2-enh:latest,Grid Integration Complexity,"Transitioning from AC to DC systems requires significant changes to existing grid infrastructure, creating technical complexities and potential compatibility issues.",0,20260505_121738,no,False,1,1,,grid compatibility issues,1,,gpt-5.4-mini,0.2,"Grid Integration Complexity. Transitioning from AC to DC systems requires significant changes to existing grid infrastructure, creating technical complexities and potential compatibility issues.",7,1.0,technical,general,AC grid integration complexity
phi4-normative2_00_b2,phi4,phi4-normative2,normative,phi4-normative2-enh:latest,Standardization Gaps,The lack of unified standards for DC technology across regions can hinder widespread adoption by complicating interoperability and regulatory compliance.,0,20260505_121738,no,False,1,1,,interoperability and compliance,1,,gpt-5.4-mini,0.2,Standardization Gaps. The lack of unified standards for DC technology across regions can hinder widespread adoption by complicating interoperability and regulatory compliance.,5,0.754717765418603,general,technical,DC market readiness and standardization challenges
phi4-normative2_00_b3,phi4,phi4-normative2,normative,phi4-normative2-enh:latest,Economic Uncertainty,Initial costs associated with transitioning to DC systems may deter investment due to uncertain return on investment timelines and economic feasibility in different market conditions.,0,20260505_121738,no,False,1,1,,investment risk,1,,gpt-5.4-mini,0.2,Economic Uncertainty. Initial costs associated with transitioning to DC systems may deter investment due to uncertain return on investment timelines and economic feasibility in different market conditions.,8,0.8793042337261688,general,policy,Economic uncertainty and ROI
phi4-normative2_00_b4,phi4,phi4-normative2,normative,phi4-normative2-enh:latest,Skilled Workforce Deficit,"A shortage of professionals trained specifically in DC technologies can slow down implementation, leading to project delays and increased reliance on external expertise.",0,20260505_121738,no,False,1,1,,skilled labor shortage,1,,gpt-5.4-mini,0.2,"Skilled Workforce Deficit. A shortage of professionals trained specifically in DC technologies can slow down implementation, leading to project delays and increased reliance on external expertise.",2,1.0,general,technical,Shortage in skilled workforce 
phi4-normative2_00_b5,phi4,phi4-normative2,normative,phi4-normative2-enh:latest,Public Perception Challenges,"Limited public awareness and understanding of the benefits of DC systems may result in resistance to adoption, particularly in consumer-facing applications like residential energy use.",0,20260505_121738,no,False,1,1,,public awareness,1,,gpt-5.4-mini,0.2,"Public Perception Challenges. Limited public awareness and understanding of the benefits of DC systems may result in resistance to adoption, particularly in consumer-facing applications like residential energy use.",14,1.0,policy,general,Public awareness and acceptance
phi4-subject_matter_00_b1,phi4,phi4-subject_matter,subject_matter,phi4-subject_matter-enh:latest,Interoperability Challenges,"The lack of standardized interfaces between DC systems and existing AC infrastructure can create significant integration challenges, leading to increased complexity and costs during implementation.",0,20260505_121738,no,False,1,1,,integration complexity,1,,gpt-5.4-mini,0.2,"Interoperability Challenges. The lack of standardized interfaces between DC systems and existing AC infrastructure can create significant integration challenges, leading to increased complexity and costs during implementation.",13,1.0,technical,general,Interoperability challenges with existing AC infrastructure
phi4-subject_matter_00_b2,phi4,phi4-subject_matter,subject_matter,phi4-subject_matter-enh:latest,Limited Awareness and Training,"There is insufficient awareness and technical training available for engineers and technicians on DC technologies, which hinders effective adoption and efficient operation in various industries.",0,20260505_121738,no,False,1,1,,lack of technical training,1,,gpt-5.4-mini,0.2,"Limited Awareness and Training. There is insufficient awareness and technical training available for engineers and technicians on DC technologies, which hinders effective adoption and efficient operation in various industries.",2,1.0,general,technical,Shortage in skilled workforce 
phi4-subject_matter_00_b3,phi4,phi4-subject_matter,subject_matter,phi4-subject_matter-enh:latest,Economic Uncertainty,"The initial high capital expenditure required for transitioning to DC systems can deter investment, especially when long-term economic benefits are uncertain or difficult to quantify compared to established AC systems.",0,20260505_121738,no,False,1,1,,high upfront costs,1,,gpt-5.4-mini,0.2,"Economic Uncertainty. The initial high capital expenditure required for transitioning to DC systems can deter investment, especially when long-term economic benefits are uncertain or difficult to quantify compared to established AC systems.",8,1.0,general,policy,Economic uncertainty and ROI
phi4-subject_matter_00_b4,phi4,phi4-subject_matter,subject_matter,phi4-subject_matter-enh:latest,Regulatory Hurdles,"Existing electrical codes and regulations are predominantly designed around AC systems, posing regulatory challenges that need addressing before widespread DC adoption can occur.",0,20260505_121738,no,False,1,1,,ac-centric regulations,1,,gpt-5.4-mini,0.2,"Regulatory Hurdles. Existing electrical codes and regulations are predominantly designed around AC systems, posing regulatory challenges that need addressing before widespread DC adoption can occur.",3,1.0,policy,general,Regulatory uncertainty and hurdles
phi4-subject_matter_00_b5,phi4,phi4-subject_matter,subject_matter,phi4-subject_matter-enh:latest,Supply Chain Constraints,"The current supply chain for DC components is not as mature or extensive as for AC systems, leading to potential shortages and delays in sourcing necessary hardware like converters and cables.",0,20260505_121738,no,False,1,1,,component supply shortages,1,,gpt-5.4-mini,0.2,"Supply Chain Constraints. The current supply chain for DC components is not as mature or extensive as for AC systems, leading to potential shortages and delays in sourcing necessary hardware like converters and cables.",10,1.0,technical,general,DC supply chain constraints
phi4-subject_matter2_00_b1,phi4,phi4-subject_matter2,subject_matter,phi4-subject_matter2-enh:latest,Interoperability Challenges,"The integration of DC systems with existing AC infrastructure can face significant interoperability issues, particularly when it comes to ensuring seamless communication and compatibility between new DC components and legacy AC equipment.",0,20260505_121738,no,False,1,1,,ac-dc compatibility issues,1,,gpt-5.4-mini,0.2,"Interoperability Challenges. The integration of DC systems with existing AC infrastructure can face significant interoperability issues, particularly when it comes to ensuring seamless communication and compatibility between new DC components and legacy AC equipment.",13,0.7821877325526719,technical,general,Interoperability challenges with existing AC infrastructure
phi4-subject_matter2_00_b2,phi4,phi4-subject_matter2,subject_matter,phi4-subject_matter2-enh:latest,Cost Implications for Transition,"The initial costs associated with transitioning from traditional AC systems to DC, including the need for new hardware and redesign of electrical layouts, can be a substantial financial barrier for many organizations considering adoption.",0,20260505_121738,no,False,1,1,,high transition costs,1,,gpt-5.4-mini,0.2,"Cost Implications for Transition. The initial costs associated with transitioning from traditional AC systems to DC, including the need for new hardware and redesign of electrical layouts, can be a substantial financial barrier for many organizations considering adoption.",9,1.0,general,technical,High upfront transition costs
phi4-subject_matter2_00_b3,phi4,phi4-subject_matter2,subject_matter,phi4-subject_matter2-enh:latest,Skilled Workforce Shortage,"There is a limited pool of professionals who are trained or experienced in designing, installing, and maintaining DC systems. This shortage could slow down implementation efforts and increase project costs due to the need for specialized training programs.",0,20260505_121738,no,False,1,1,,skilled labor shortage,1,,gpt-5.4-mini,0.2,"Skilled Workforce Shortage. There is a limited pool of professionals who are trained or experienced in designing, installing, and maintaining DC systems. This shortage could slow down implementation efforts and increase project costs due to the need for specialized training programs.",2,1.0,general,technical,Shortage in skilled workforce 
phi4-subject_matter2_00_b4,phi4,phi4-subject_matter2,subject_matter,phi4-subject_matter2-enh:latest,Regulatory Hurdles,"Existing electrical codes and standards predominantly cater to AC systems. The lack of comprehensive regulatory frameworks specifically addressing DC technology poses a barrier, as it can lead to delays in approvals and increased compliance costs.",0,20260505_121738,no,False,1,1,,regulatory compliance gaps,1,,gpt-5.4-mini,0.2,"Regulatory Hurdles. Existing electrical codes and standards predominantly cater to AC systems. The lack of comprehensive regulatory frameworks specifically addressing DC technology poses a barrier, as it can lead to delays in approvals and increased compliance costs.",3,1.0,policy,general,Regulatory uncertainty and hurdles
phi4-subject_matter2_00_b5,phi4,phi4-subject_matter2,subject_matter,phi4-subject_matter2-enh:latest,Public Perception and Acceptance,"Despite the potential benefits of DC systems, there may be resistance from stakeholders due to unfamiliarity or misconceptions about DC technologies. This could hinder adoption rates until public perception shifts towards recognizing the advantages of DC systems.",0,20260505_121738,no,False,1,1,,public acceptance,1,,gpt-5.4-mini,0.2,"Public Perception and Acceptance. Despite the potential benefits of DC systems, there may be resistance from stakeholders due to unfamiliarity or misconceptions about DC technologies. This could hinder adoption rates until public perception shifts towards recognizing the advantages of DC systems.",14,1.0,policy,general,Public awareness and acceptance
gemma3-generalist_00_b1,gemma3:12b,gemma3-generalist,generalist,gemma-generalist-enh:latest,Lack of Standardized Component Lifecycles,"DC component lifecycles (e.g., converter degradation, cable insulation) are less understood than AC, hindering long-term planning and maintenance budgets.",0,20260505_121738,no,False,2,2,,uncertain component lifecycles,1,,gpt-5.4-mini,0.2,"Lack of Standardized Component Lifecycles. DC component lifecycles (e.g., converter degradation, cable insulation) are less understood than AC, hindering long-term planning and maintenance budgets.",11,1.0,technical,general,DC component cost and availability
gemma3-generalist_00_b2,gemma3:12b,gemma3-generalist,generalist,gemma-generalist-enh:latest,Limited Interoperability Testing & Certification,The absence of widely accepted interoperability testing and certification programs creates uncertainty and risk for system integrators and end-users.,0,20260505_121738,no,False,2,2,,interoperability certification gap,1,,gpt-5.4-mini,0.2,Limited Interoperability Testing & Certification. The absence of widely accepted interoperability testing and certification programs creates uncertainty and risk for system integrators and end-users.,4,1.0,technical,policy,DC interoperability standardization and cartification gap
gemma3-generalist_00_b3,gemma3:12b,gemma3-generalist,generalist,gemma-generalist-enh:latest,Retrofit Costs & Disruption,Replacing existing AC infrastructure with DC systems in established facilities is often prohibitively expensive and disruptive to operations.,0,20260505_121738,no,False,2,2,,retrofit cost disruption,1,,gpt-5.4-mini,0.2,Retrofit Costs & Disruption. Replacing existing AC infrastructure with DC systems in established facilities is often prohibitively expensive and disruptive to operations.,12,1.0,technical,general,Retrofit complexity in existing infrastructure
gemma3-generalist_00_b4,gemma3:12b,gemma3-generalist,generalist,gemma-generalist-enh:latest,Workforce Skill Gap,"A shortage of skilled technicians and engineers familiar with DC system design, installation, and maintenance will slow adoption.",0,20260505_121738,no,False,2,2,,skilled workforce shortage,1,,gpt-5.4-mini,0.2,"Workforce Skill Gap. A shortage of skilled technicians and engineers familiar with DC system design, installation, and maintenance will slow adoption.",2,1.0,general,technical,Shortage in skilled workforce 
gemma3-generalist_00_b5,gemma3:12b,gemma3-generalist,generalist,gemma-generalist-enh:latest,Cybersecurity Vulnerabilities in DC Microgrids,"DC microgrids, with their distributed nature, present unique cybersecurity challenges requiring specialized protection measures and expertise.",0,20260505_121738,no,False,2,2,,cybersecurity challenges,1,,gpt-5.4-mini,0.2,"Cybersecurity Vulnerabilities in DC Microgrids. DC microgrids, with their distributed nature, present unique cybersecurity challenges requiring specialized protection measures and expertise.",1,1.0,technical,policy,Cybersecurity vulnerabilities in DC microgrids
gemma3-generalist2_00_b1,gemma3:12b,gemma3-generalist2,generalist,gemma-generalist2-enh:latest,Lack of Standardized Interoperability,"Current DC component designs often lack standardized communication protocols, hindering seamless integration between different manufacturers' equipment.",0,20260505_121738,no,False,2,2,,interoperability standards,1,,gpt-5.4-mini,0.2,"Lack of Standardized Interoperability. Current DC component designs often lack standardized communication protocols, hindering seamless integration between different manufacturers' equipment.",4,1.0,technical,policy,DC interoperability standardization and cartification gap
gemma3-generalist2_00_b2,gemma3:12b,gemma3-generalist2,generalist,gemma-generalist2-enh:latest,Limited Availability of Skilled Workforce,"A shortage of engineers and technicians with expertise in DC power systems design, installation, and maintenance poses a significant hurdle.",0,20260505_121738,no,False,2,2,,skilled workforce shortage,1,,gpt-5.4-mini,0.2,"Limited Availability of Skilled Workforce. A shortage of engineers and technicians with expertise in DC power systems design, installation, and maintenance poses a significant hurdle.",2,1.0,general,technical,Shortage in skilled workforce 
gemma3-generalist2_00_b3,gemma3:12b,gemma3-generalist2,generalist,gemma-generalist2-enh:latest,Safety Perception & Training,"Public and worker perception of DC safety, coupled with a need for specialized training on high-voltage DC systems, requires proactive mitigation.",0,20260505_121738,no,False,2,2,,safety training needs,1,,gpt-5.4-mini,0.2,"Safety Perception & Training. Public and worker perception of DC safety, coupled with a need for specialized training on high-voltage DC systems, requires proactive mitigation.",-1,0.0,,,
